user_input,retrieved_contexts,response,reference,context_recall,faithfulness,factual_correctness(mode=f1)
Rối loạn nhân cách Sizoid thuộc nhóm rối loạn nhân cách nào?,"['15.2.2 Rối loạn nhân cách Sizoid (Schizoid2 Personality Disorder)\n[15.2.2 Rối loạn nhân cách Sizoid (Schizoid2 Personality Disorder) > 15.2 Rối loạn nhân cách nhóm A (Cluster A Personality Disorder) > 15 RỐI LOẠN NHÂN CÁCH]\n15.2.2 Rối loạn nhân cách Sizoid (Schizoid2 Personality Disorder) 15.2.2 Rối loạn nhân cách Sizoid (Schizoid2 Personality Disorder)  15.2 Rối loạn nhân cách nhóm A (Cluster A Personality Disorder)  15 RỐI LOẠN NHÂN CÁCH. None', '15.4.2 Rối loạn nhân cách phụ thuộc\n[15.4.2 Rối loạn nhân cách phụ thuộc > 15.4 Rối loạn nhân cách nhóm C > 15 RỐI LOẠN NHÂN CÁCH]\n15.4.2 Rối loạn nhân cách phụ thuộc 15.4.2 Rối loạn nhân cách phụ thuộc  15.4 Rối loạn nhân cách nhóm C  15 RỐI LOẠN NHÂN CÁCH. 3. Khó biểu hiện sự phản đối với người khác do sợ bị mất sự hỗ trợ. Lưu ý:không bao gồm sợ bị trả thù thực sự.', '15.1 Rối loạn nhân cách chung (General Personality Disorder). 15.2 Rối loạn nhân cách nhóm A (Cluster A Personality Disorder)\n[15.2 Rối loạn nhân cách nhóm A (Cluster A Personality Disorder) > 15 RỐI LOẠN NHÂN CÁCH]\n15.1 Rối loạn nhân cách chung (General Personality Disorder) 15.1 Rối loạn nhân cách chung (General Personality Disorder)  15 RỐI LOẠN NHÂN CÁCH. None\n15.2 Rối loạn nhân cách nhóm A (Cluster A Personality Disorder) 15.2 Rối loạn nhân cách nhóm A (Cluster A Personality Disorder)  15 RỐI LOẠN NHÂN CÁCH. None', '15.3.2 Rối loạn nhân cách ranh giới (BorderlinePersonality Disorder)\n[15.3.2 Rối loạn nhân cách ranh giới (BorderlinePersonality Disorder) > 15.3 Rối loạn nhân cách nhóm B > 15 RỐI LOẠN NHÂN CÁCH]\n15.3.2 Rối loạn nhân cách ranh giới (BorderlinePersonality Disorder) 15.3.2 Rối loạn nhân cách ranh giới (BorderlinePersonality Disorder)  15.3 Rối loạn nhân cách nhóm B  15 RỐI LOẠN NHÂN CÁCH. 5. Tái phát sự đe dọa hoặc có hành vi tự sát và hành vi tự hủy hoại cơ thể.', '15.4.2 Rối loạn nhân cách phụ thuộc\n[15.4.2 Rối loạn nhân cách phụ thuộc > 15.4 Rối loạn nhân cách nhóm C > 15 RỐI LOẠN NHÂN CÁCH]\n15.4.2 Rối loạn nhân cách phụ thuộc 15.4.2 Rối loạn nhân cách phụ thuộc  15.4 Rối loạn nhân cách nhóm C  15 RỐI LOẠN NHÂN CÁCH. Mã số: 301.6 (F60.7) 99 Luôn mong muốn được phụ thuộc vào người khác, được sự chỉ huy của người khác, được che trở và sợ phải ở một mình, bắt đầu sớm ở người trưởng thành, biểu hiện trong nhiều lĩnh vực khác nhau, có 5 hoặc hơn các triệu chứng sau: 1. Khó khăn khi phải ra quyết định hằng ngày nếu không có các lời khuyên và đảm bảo của người khác. 2. Cần người khác chỉ đạo trong hầu hết các lĩnh vực quan trọng trong cuộc sống của bệnh nhân. 3. Khó biểu hiện sự phản đối với người khác do sợ bị mất sự hỗ trợ. Lưu ý: không bao gồm sợ bị trả thù thực sự. 4. Khó bắt đầu tự làm một việc gì đó (do không tự tin về các phán đoán của mình hơn là không có khả năng hoặc không có năng lượng). 5. Luôn mất rất nhiều thời gian tìm kiếm sự giúp đỡ của người khác, sự chỉ bảo của người tình nguyện để làm một việc gì mà bệnh nhân không thích. 6. Cảm thấy khó chịu và không được giúp đỡ khi ở một mình vì họ sợ không ai có thể chăm sóc được họ. 7. Nhanh chóng tìm kiếm người khác để chăm sóc và hỗ trợ họ khi mối quan hệ với người thân cũ đã kết thúc. 8. Luôn bận tâm một cách vô lý về việc sợ phải tự chăm sóc bản thân mình. Chẩn đoán phân biệt - Sự phụ thuộc có thể gặp trong nhiều dạng rối loạn tâm thần khác nhau, do vậy chẩn đoán phân biệt là rất khó khăn. Phụ thuộc cũng nổi bật trong rối loạn nhân cách thể kịch tính, thể ranh giới, nhưng với cường độ nhẹ hơn và không diễn ra trên tất cả các lĩnh vực của cuộc sống. - Bệnh nhân rối loạn nhân cách thể khép kín và dạng phân liệt dễ phân biệt với rối loạn nhân cách thể phụ thuộc.', '15.3.2 Rối loạn nhân cách ranh giới (BorderlinePersonality Disorder)\n[15.3.2 Rối loạn nhân cách ranh giới (BorderlinePersonality Disorder) > 15.3 Rối loạn nhân cách nhóm B > 15 RỐI LOẠN NHÂN CÁCH]\n15.3.2 Rối loạn nhân cách ranh giới (BorderlinePersonality Disorder) 15.3.2 Rối loạn nhân cách ranh giới (BorderlinePersonality Disorder)  15.3 Rối loạn nhân cách nhóm B  15 RỐI LOẠN NHÂN CÁCH. 4. Có xung động tự làm hại mình rõ ràng trên ít nhất 2 khía cạnh (tiêu tiền, quan hệ tình dục, lạm dụng ma túy, lái xe cẩu thả, ăn vô độ). Lưu ý: không bao gồm hành vi tự sát hoặc tự hủy hoại mình.', '2.1 Rối loạn kiểu (nhân cách) phân liệt (Schizotypal Disorder).\n[2.1 Rối loạn kiểu (nhân cách) phân liệt (Schizotypal Disorder). > 2 RỐI LOẠN PHỔ TÂM THẦN PHÂN LIỆT VÀ CÁC RỐI LOẠN]\n2.1 Rối loạn kiểu (nhân cách) phân liệt (Schizotypal Disorder). 2.1 Rối loạn kiểu (nhân cách) phân liệt (Schizotypal Disorder).  2 RỐI LOẠN PHỔ TÂM THẦN PHÂN LIỆT VÀ CÁC RỐI LOẠN. Mã số 301.22 Xem trong mục Rối loạn nhân cách', '15.3.3 Rối loạn nhân cách kịch tính (HistrionicPersonality Disorder)\n[15.3.3 Rối loạn nhân cách kịch tính (HistrionicPersonality Disorder) > 15.3 Rối loạn nhân cách nhóm B > 15 RỐI LOẠN NHÂN CÁCH]\n15.3.3 Rối loạn nhân cách kịch tính (HistrionicPersonality Disorder) 15.3.3 Rối loạn nhân cách kịch tính (HistrionicPersonality Disorder)  15.3 Rối loạn nhân cách nhóm B  15 RỐI LOẠN NHÂN CÁCH. 2. Trong mối quan hệ với người khác, họ hay quyến rũ về tình dục hoặc có hành vi khiêu khích.', '15.3.2 Rối loạn nhân cách ranh giới (BorderlinePersonality Disorder)\n[15.3.2 Rối loạn nhân cách ranh giới (BorderlinePersonality Disorder) > 15.3 Rối loạn nhân cách nhóm B > 15 RỐI LOẠN NHÂN CÁCH]\n15.3.2 Rối loạn nhân cách ranh giới (BorderlinePersonality Disorder) 15.3.2 Rối loạn nhân cách ranh giới (BorderlinePersonality Disorder)  15.3 Rối loạn nhân cách nhóm B  15 RỐI LOẠN NHÂN CÁCH. Họ không có biểu hiện giao động về cảm xúc, không có cảm giác trống rỗng như rối loạn nhân cách thể ranh giới.', '15.3.3 Rối loạn nhân cách kịch tính (HistrionicPersonality Disorder)\n[15.3.3 Rối loạn nhân cách kịch tính (HistrionicPersonality Disorder) > 15.3 Rối loạn nhân cách nhóm B > 15 RỐI LOẠN NHÂN CÁCH]\n15.3.3 Rối loạn nhân cách kịch tính (HistrionicPersonality Disorder) 15.3.3 Rối loạn nhân cách kịch tính (HistrionicPersonality Disorder)  15.3 Rối loạn nhân cách nhóm B  15 RỐI LOẠN NHÂN CÁCH. 10. Thái độ hoặc hành vi ngạo mạn, kiêu căng Chẩn đoán phân biệt 98 - Các rối loạn nhân cách thể ranh giới, kịch phát và chống xã hội thường phối hợp với rối loạn nhân cách thể tự yêu mình nên chẩn đoán phân biệt là khó khăn.- Bệnh nhân rối loạn nhân cách thể tự yêu mình ít tỏ ra lo lắng hơn bệnh nhân rối loạn nhân cách thể ranh giới. Cuộc sống của họ ít hỗn loạn và họ ít khi có ý định tự sát.- Bệnh nhân rối loạn nhân cách thể chống xã hội trong tiền sử có nhiều hành vi xung động, hay phối hợp với lạm dụng rượu và ma túy và có nhiều vướng mắc với pháp luật.- Bệnh nhân rối loạn nhân cách thể kịch tính có đặc điểm là thích phô trương, lôi cuốn trong quan hệ với mọi người hơn là rối loạn nhân cách thể tự yêu mình.']","Rối loạn nhân cách Sizoid (Schizoid Personality Disorder) thuộc nhóm rối loạn nhân cách nhóm A (Cluster A Personality Disorder). Thông tin này được đề cập trong đoạn văn ""[15.2.2 Rối loạn nhân cách Sizoid (Schizoid2 Personality Disorder) > 15.2 Rối loạn nhân cách nhóm A (Cluster A Personality Disorder) > 15 RỐI LOẠN NHÂN CÁCH]"". Điều này cho thấy rằng rối loạn nhân cách Sizoid được phân loại vào nhóm A, cùng với các rối loạn nhân cách khác như rối loạn kiểu (nhân cách) phân liệt (Schizotypal Disorder).",Nhóm A (Cluster A Personality Disorder),1.0,0.75,0.8
Ám ảnh sợ chuyên biệt thường biểu hiện như thế nào ở trẻ em?,"['5.3 Ám ảnh sợ chuyên biệt (Specific Phobia)\n[5.3 Ám ảnh sợ chuyên biệt (Specific Phobia) > 5 RỐI LOẠN LO ÂU]\n5.3 Ám ảnh sợ chuyên biệt (Specific Phobia) 5.3 Ám ảnh sợ chuyên biệt (Specific Phobia)  5 RỐI LOẠN LO ÂU. A. Sợ hãi hoặc lo âu về một đối tượng hoặc tình huống đặc biệt (ví dụ: đi máy bay, sợ độ cao, sợ động vật, sợ tiêm thuốc, nhìn thấy máu).Lưu ý: ở trẻ em, sợ hãi hoặc lo âu có thể biểu hiện bằng khóc, cáu kỉnh, bất động (freezing), giữ chặt vật gì hoặc bám vào ai đó (clinging).', '5.3 Ám ảnh sợ chuyên biệt (Specific Phobia)\n[5.3 Ám ảnh sợ chuyên biệt (Specific Phobia) > 5 RỐI LOẠN LO ÂU]\n5.3 Ám ảnh sợ chuyên biệt (Specific Phobia) 5.3 Ám ảnh sợ chuyên biệt (Specific Phobia)  5 RỐI LOẠN LO ÂU. C. Các đối tượng hoặc tình huống gây ám ảnh sợ gây ra né tránh hoặc chịu đựng với sự sợ hãi hoặc lo âu mạnh mẽ.', '5.3 Ám ảnh sợ chuyên biệt (Specific Phobia)\n[5.3 Ám ảnh sợ chuyên biệt (Specific Phobia) > 5 RỐI LOẠN LO ÂU]\n5.3 Ám ảnh sợ chuyên biệt (Specific Phobia) 5.3 Ám ảnh sợ chuyên biệt (Specific Phobia)  5 RỐI LOẠN LO ÂU. B. Các đối tượng hoặc tình huống gây ám ảnh sợ hầu hết luôn kí ch thích gây sợ hãi và lo âu ngay lập tức.', '5.3 Ám ảnh sợ chuyên biệt (Specific Phobia)\n[5.3 Ám ảnh sợ chuyên biệt (Specific Phobia) > 5 RỐI LOẠN LO ÂU]\n5.3 Ám ảnh sợ chuyên biệt (Specific Phobia) 5.3 Ám ảnh sợ chuyên biệt (Specific Phobia)  5 RỐI LOẠN LO ÂU. D. Sợ hãi và lo âu không tương xứng với sự nguy hiểm thực sự của đối tượng hoặc tình huống gây ám ảnh sợ và bối cảnh văn hóa xã hội.', '5.3 Ám ảnh sợ chuyên biệt (Specific Phobia)\n[5.3 Ám ảnh sợ chuyên biệt (Specific Phobia) > 5 RỐI LOẠN LO ÂU]\n5.3 Ám ảnh sợ chuyên biệt (Specific Phobia) 5.3 Ám ảnh sợ chuyên biệt (Specific Phobia)  5 RỐI LOẠN LO ÂU. G. Rối loạn không thể giải thích tốt hơn do rối loạn tâm thần khác bao gồm các triệu chứng sợ hãi, lo âu, né tránh các tình huống liên quan đến các các triệu chứng giống rối loạn hoảng sợ hoặc các triệu chứng mất khả năng (như trong ám ảnh sợ khoảng trống); đối tượng và tình huống liên quan đến ám ảnh (như trong rối loạn ám ảnh  cưỡng bức); nhắc lại tình huống sang chấn (như trong rối loạn stress sau sang chấn); ra khỏi nhà hoặc tách khỏi người thân (như trong rối loạn lo âu bị chia tách); hoặc các tình huống xã hội (như trong rối loạn lo âu xã hội).Chẩn đoán phân biệt:- Ám ảnh sợ khoảng trống.- Rối loạn lo âu xã hội.- Rối loạn lo âu chia tách.- Rối loạn hoảng sợ.- Rối loạn ám ảnh  cưỡng bức.- PTSD.- Rối loạn ăn.- Rối loạn phổ phân liệt và các rối loạn loạn thần khác.', '5.4 Rối loạn lo âu xã hội (ám ảnh sợ xã\n[5.4 Rối loạn lo âu xã hội (ám ảnh sợ xã > 5 RỐI LOẠN LO ÂU]\n5.4 Rối loạn lo âu xã hội (ám ảnh sợ xã 5.4 Rối loạn lo âu xã hội (ám ảnh sợ xã  5 RỐI LOẠN LO ÂU. C. Các tình huống xã hội hầu nh ư đều gây sợ hãi hay lo âu.Lưu ý: ở trẻ em, nỗi sợ hãi hay lo âu có thể được thể hiện bằng cách khóc, ăn vạ, bất động, bám, thu hẹp lại, hoặc không nói chuyện trong các tình huống xã hội.', '5.3 Ám ảnh sợ chuyên biệt (Specific Phobia)\n[5.3 Ám ảnh sợ chuyên biệt (Specific Phobia) > 5 RỐI LOẠN LO ÂU]\n5.3 Ám ảnh sợ chuyên biệt (Specific Phobia) 5.3 Ám ảnh sợ chuyên biệt (Specific Phobia)  5 RỐI LOẠN LO ÂU. E. Sự sợ hãi, lo âu, né tránh dai dẳng, kéo dài ít nhất 6 tháng.', '5.4 Rối loạn lo âu xã hội (ám ảnh sợ xã\n[5.4 Rối loạn lo âu xã hội (ám ảnh sợ xã > 5 RỐI LOẠN LO ÂU]\n5.4 Rối loạn lo âu xã hội (ám ảnh sợ xã 5.4 Rối loạn lo âu xã hội (ám ảnh sợ xã  5 RỐI LOẠN LO ÂU. A. Sợ hãi hay lo âurõ ràng về một hoặc Ví dụ nhiều tình huống xã hội mà trong đó bệnh nhânđược tiếp xúc và giám sát bởi người khác , dạng như tương tác xã hội (một cuộc trò chuyện, gặp gỡ những người không quen), bị quan sát (ví dụ:ăn hay uống), và trình diễn trước những người khác (ví dụ : phát biểu trước đám đông).Lưu ý: ở trẻ em, sự lo lắng phải xảy ra trong các tình huống cùng lứa tuổi và 45 không chỉ trong tương tác với người lớn.46', '7.3 Rối loạn stress sau sang chấn (Posttraumatic Stress Disorder-PTSD)\n[7.3 Rối loạn stress sau sang chấn (Posttraumatic Stress Disorder-PTSD) > 7 CÁC RỐI LOẠN LIÊN QUAN ĐẾN CHẤN THƯƠNG VÀ STRESS]\n7.3 Rối loạn stress sau sang chấn (Posttraumatic Stress Disorder-PTSD) 7.3 Rối loạn stress sau sang chấn (Posttraumatic Stress Disorder-PTSD)  7 CÁC RỐI LOẠN LIÊN QUAN ĐẾN CHẤN THƯƠNG VÀ STRESS. A. Ở trẻ em dưới hoặc bằng 6 tuổi, sự phơi nhiễm với cái chết thật sự hoặc đe dọa chết, bị thương nặng hoặc bạo hành tình dục theo một (hoặc nhiều hơn)trong số những cách sau đây:1. Trực tiếp trải nghiệm sự kiện gây sang chấn.2. Chứng kiến tận mắt sự kiện khi nó xảy ra với những người khác đặc biệt là những người chăm sóc gần gũi nhất.61 Lưu ý: Chứng kiến không bao gồm những sự kiện được nhìn thấy chỉ trên phương tiện truyền thông điện tử, TV, phim ảnh hoặc tranh ảnh.3. Nghe rằng sự kiện gây sang chấn xảy ra với bố hoặc mẹ hoặc người chăm sóc.', '5.6 Ám ảnh sợ khoảng trống (Agoraphobia)\n[5.6 Ám ảnh sợ khoảng trống (Agoraphobia) > 5 RỐI LOẠN LO ÂU]\n5.6 Ám ảnh sợ khoảng trống (Agoraphobia) 5.6 Ám ảnh sợ khoảng trống (Agoraphobia)  5 RỐI LOẠN LO ÂU. B. Bệnh nhân sợ hãi hoặc né tránh các tình huống trên bởi vì họ nghĩ rằng khó thoát khỏi tình huống hoặc không có người giúp đỡ trong trường hợp có các triệu chứng giống cơn hoảng sợ kịch phát hoặc các triệu chứng mất kiểm soát hoặc các tình huống khó khăn khác (ví dụ: sợ ngã ở người cao tuổi, sợ t iểu tiện không tự chủ).49']","Ám ảnh sợ chuyên biệt ở trẻ em thường biểu hiện khác so với người lớn. Theo tiêu chí chẩn đoán tại điểm A của Ám ảnh sợ chuyên biệt (5.3), ở trẻ em, sợ hãi hoặc lo âu có thể biểu hiện bằng khóc, cáu kỉnh, bất động (freezing), giữ chặt vật gì hoặc bám vào ai đó (clinging). Điều này cho thấy rằng trẻ em có thể không thể hiện nỗi sợ hãi hoặc lo âu một cách rõ ràng như người lớn, mà thay vào đó, chúng có thể thể hiện thông qua các hành vi như khóc, cáu kỉnh hoặc bám vào người khác.","Sợ hãi hoặc lo âu có thể biểu hiện bằng khóc, cáu kỉnh, bất động, giữ chặt vật gì hoặc bám vào ai đó",1.0,0.8,0.36
Người mắc rối loạn nhân cách kịch tính thường lo lắng về những điều gì?,"['15.3.3 Rối loạn nhân cách kịch tính (HistrionicPersonality Disorder)\n[15.3.3 Rối loạn nhân cách kịch tính (HistrionicPersonality Disorder) > 15.3 Rối loạn nhân cách nhóm B > 15 RỐI LOẠN NHÂN CÁCH]\n15.3.3 Rối loạn nhân cách kịch tính (HistrionicPersonality Disorder) 15.3.3 Rối loạn nhân cách kịch tính (HistrionicPersonality Disorder)  15.3 Rối loạn nhân cách nhóm B  15 RỐI LOẠN NHÂN CÁCH. 2. Trong mối quan hệ với người khác, họ hay quyến rũ về tình dục hoặc có hành vi khiêu khích.', '15.3.3 Rối loạn nhân cách kịch tính (HistrionicPersonality Disorder)\n[15.3.3 Rối loạn nhân cách kịch tính (HistrionicPersonality Disorder) > 15.3 Rối loạn nhân cách nhóm B > 15 RỐI LOẠN NHÂN CÁCH]\n15.3.3 Rối loạn nhân cách kịch tính (HistrionicPersonality Disorder) 15.3.3 Rối loạn nhân cách kịch tính (HistrionicPersonality Disorder)  15.3 Rối loạn nhân cách nhóm B  15 RỐI LOẠN NHÂN CÁCH. 7. Luôn cho rằng dễ dàng ảnh hưởng đến người những người xung quanh.', '15.3.3 Rối loạn nhân cách kịch tính (HistrionicPersonality Disorder)\n[15.3.3 Rối loạn nhân cách kịch tính (HistrionicPersonality Disorder) > 15.3 Rối loạn nhân cách nhóm B > 15 RỐI LOẠN NHÂN CÁCH]\n15.3.3 Rối loạn nhân cách kịch tính (HistrionicPersonality Disorder) 15.3.3 Rối loạn nhân cách kịch tính (HistrionicPersonality Disorder)  15.3 Rối loạn nhân cách nhóm B  15 RỐI LOẠN NHÂN CÁCH. 9. Thường ghen tị với người khác hoặc tin rằng người khác ghen tị với mình.', '15.3.3 Rối loạn nhân cách kịch tính (HistrionicPersonality Disorder)\n[15.3.3 Rối loạn nhân cách kịch tính (HistrionicPersonality Disorder) > 15.3 Rối loạn nhân cách nhóm B > 15 RỐI LOẠN NHÂN CÁCH]\n15.3.3 Rối loạn nhân cách kịch tính (HistrionicPersonality Disorder) 15.3.3 Rối loạn nhân cách kịch tính (HistrionicPersonality Disorder)  15.3 Rối loạn nhân cách nhóm B  15 RỐI LOẠN NHÂN CÁCH. 10. Thái độ hoặc hành vi ngạo mạn, kiêu căng Chẩn đoán phân biệt 98 - Các rối loạn nhân cách thể ranh giới, kịch phát và chống xã hội thường phối hợp với rối loạn nhân cách thể tự yêu mình nên chẩn đoán phân biệt là khó khăn.- Bệnh nhân rối loạn nhân cách thể tự yêu mình ít tỏ ra lo lắng hơn bệnh nhân rối loạn nhân cách thể ranh giới. Cuộc sống của họ ít hỗn loạn và họ ít khi có ý định tự sát.- Bệnh nhân rối loạn nhân cách thể chống xã hội trong tiền sử có nhiều hành vi xung động, hay phối hợp với lạm dụng rượu và ma túy và có nhiều vướng mắc với pháp luật.- Bệnh nhân rối loạn nhân cách thể kịch tính có đặc điểm là thích phô trương, lôi cuốn trong quan hệ với mọi người hơn là rối loạn nhân cách thể tự yêu mình.', '15.3.3 Rối loạn nhân cách kịch tính (HistrionicPersonality Disorder)\n[15.3.3 Rối loạn nhân cách kịch tính (HistrionicPersonality Disorder) > 15.3 Rối loạn nhân cách nhóm B > 15 RỐI LOẠN NHÂN CÁCH]\n15.3.3 Rối loạn nhân cách kịch tính (HistrionicPersonality Disorder) 15.3.3 Rối loạn nhân cách kịch tính (HistrionicPersonality Disorder)  15.3 Rối loạn nhân cách nhóm B  15 RỐI LOẠN NHÂN CÁCH. 2. Lo lắng một cách kỳ lạ về sự thành đạt không giới hạn, quyền lực, nổi tiếng, sắc đẹp và tình yêu. 3. Tin tưởng rằng mình là người duy nhất và chỉ có những người đặc biệt khác hoặc người ở tầng lớp cao của xã hội mới có thể hiểu và hợp tác với mình được. 4. Luôn đòi hỏi được mọi người ngưỡng mộ mình. 5. Cho rằng mình có nhiều quyền lực, nghĩa là bắt mọi người phải tuân thủ mọi ý kiến của mình. 6. Dễ nổi giận trong quan hệ với mọi người khi ý kiến của mình không được lắng nghe và tuân theo. 7. Bóc lột trong mối quan hệ với mọi người, nghĩa là luôn dành thuận lợi về mình. 8. Thiếu sự đồng cảm: không muốn nhận ra hoặc không muốn xác định cảm xúc và nhu cầu của người khác. 9. Thường ghen tị với người khác hoặc tin rằng người khác ghen tị với mình. 10. Thái độ hoặc hành vi ngạo mạn, kiêu căng Chẩn đoán phân biệt 98 - Các rối loạn nhân cách thể ranh giới, kịch phát và chống xã hội thường phối hợp với rối loạn nhân cách thể tự yêu mình nên chẩn đoán phân biệt là khó khăn. - Bệnh nhân rối loạn nhân cách thể tự yêu mình ít tỏ ra lo lắng hơn bệnh nhân rối loạn nhân cách thể ranh giới. Cuộc sống của họ ít hỗn loạn và họ ít khi có ý định tự sát. - Bệnh nhân rối loạn nhân cách thể chống xã hội trong tiền sử có nhiều hành vi xung động, hay phối hợp với lạm dụng rượu và ma túy và có nhiều vướng mắc với pháp luật. - Bệnh nhân rối loạn nhân cách thể kịch tính có đặc điểm là thích phô trương, lôi cuốn trong quan hệ với mọi người hơn là rối loạn nhân cách thể tự yêu mình.', '15.3.3 Rối loạn nhân cách kịch tính (HistrionicPersonality Disorder)\n[15.3.3 Rối loạn nhân cách kịch tính (HistrionicPersonality Disorder) > 15.3 Rối loạn nhân cách nhóm B > 15 RỐI LOẠN NHÂN CÁCH]\n15.3.3 Rối loạn nhân cách kịch tính (HistrionicPersonality Disorder) 15.3.3 Rối loạn nhân cách kịch tính (HistrionicPersonality Disorder)  15.3 Rối loạn nhân cách nhóm B  15 RỐI LOẠN NHÂN CÁCH. 6. Dễ nổi giận trong quan hệ với mọi người khi ý kiến của mình không được lắng nghe và tuân theo.', '15.3.3 Rối loạn nhân cách kịch tính (HistrionicPersonality Disorder)\n[15.3.3 Rối loạn nhân cách kịch tính (HistrionicPersonality Disorder) > 15.3 Rối loạn nhân cách nhóm B > 15 RỐI LOẠN NHÂN CÁCH]\n15.3.3 Rối loạn nhân cách kịch tính (HistrionicPersonality Disorder) 15.3.3 Rối loạn nhân cách kịch tính (HistrionicPersonality Disorder)  15.3 Rối loạn nhân cách nhóm B  15 RỐI LOẠN NHÂN CÁCH. 4. Luôn đòi hỏi được mọi người ngưỡng mộ mình.', '15.3.3 Rối loạn nhân cách kịch tính (HistrionicPersonality Disorder)\n[15.3.3 Rối loạn nhân cách kịch tính (HistrionicPersonality Disorder) > 15.3 Rối loạn nhân cách nhóm B > 15 RỐI LOẠN NHÂN CÁCH]\n15.3.3 Rối loạn nhân cách kịch tính (HistrionicPersonality Disorder) 15.3.3 Rối loạn nhân cách kịch tính (HistrionicPersonality Disorder)  15.3 Rối loạn nhân cách nhóm B  15 RỐI LOẠN NHÂN CÁCH. 7. Bóc lột trong mối quan hệ với mọi người, nghĩa là luôn dành thuận lợi về mình.', '15.4.2 Rối loạn nhân cách phụ thuộc\n[15.4.2 Rối loạn nhân cách phụ thuộc > 15.4 Rối loạn nhân cách nhóm C > 15 RỐI LOẠN NHÂN CÁCH]\n15.4.2 Rối loạn nhân cách phụ thuộc 15.4.2 Rối loạn nhân cách phụ thuộc  15.4 Rối loạn nhân cách nhóm C  15 RỐI LOẠN NHÂN CÁCH. 3. Khó biểu hiện sự phản đối với người khác do sợ bị mất sự hỗ trợ. Lưu ý:không bao gồm sợ bị trả thù thực sự.', '15.3.2 Rối loạn nhân cách ranh giới (BorderlinePersonality Disorder)\n[15.3.2 Rối loạn nhân cách ranh giới (BorderlinePersonality Disorder) > 15.3 Rối loạn nhân cách nhóm B > 15 RỐI LOẠN NHÂN CÁCH]\n15.3.2 Rối loạn nhân cách ranh giới (BorderlinePersonality Disorder) 15.3.2 Rối loạn nhân cách ranh giới (BorderlinePersonality Disorder)  15.3 Rối loạn nhân cách nhóm B  15 RỐI LOẠN NHÂN CÁCH. 8. Dễ nổi cáu mạnh mẽ một cách vô lý hoặc khó kiểm soát được sự nổi cáu (nghĩa là dễ nổi nóng, luôn cáu kỉnh, hay đánh nhau).']","Người mắc rối loạn nhân cách kịch tính thường lo lắng về sự thành đạt không giới hạn, quyền lực, nổi tiếng, sắc đẹp và tình yêu (tiêu chí 2). Họ cũng có thể lo lắng về việc không được mọi người ngưỡng mộ mình (tiêu chí 4) và thường ghen tị với người khác hoặc tin rằng người khác ghen tị với mình (tiêu chí 9).","sự thành đạt không giới hạn, quyền lực, nổi tiếng, sắc đẹp và tình yêu",1.0,0.875,0.86
Các rối loạn liên quan đến cà phê thuộc loại rối loạn nào?,"['13.2 Các rối loạn liên quan đến cà phê\n[13.2 Các rối loạn liên quan đến cà phê > 13 CÁC RỐI LOẠN NGHIỆN VÀ CÁC RỐI LOẠN LIÊN QUAN ĐẾN]\n13.2 Các rối loạn liên quan đến cà phê 13.2 Các rối loạn liên quan đến cà phê  13 CÁC RỐI LOẠN NGHIỆN VÀ CÁC RỐI LOẠN LIÊN QUAN ĐẾN. Tiêu chuẩn chẩn đoán 305.90 (F15.929)', '13.2 Các rối loạn liên quan đến cà phê\n[13.2 Các rối loạn liên quan đến cà phê > 13 CÁC RỐI LOẠN NGHIỆN VÀ CÁC RỐI LOẠN LIÊN QUAN ĐẾN]\n13.2 Các rối loạn liên quan đến cà phê 13.2 Các rối loạn liên quan đến cà phê  13 CÁC RỐI LOẠN NGHIỆN VÀ CÁC RỐI LOẠN LIÊN QUAN ĐẾN. A. Gần đây có sử dụng caffeine (điển hình là một liều vượt trên 250 mg).', '13.2 Các rối loạn liên quan đến cà phê\n[13.2 Các rối loạn liên quan đến cà phê > 13 CÁC RỐI LOẠN NGHIỆN VÀ CÁC RỐI LOẠN LIÊN QUAN ĐẾN]\n13.2 Các rối loạn liên quan đến cà phê 13.2 Các rối loạn liên quan đến cà phê  13 CÁC RỐI LOẠN NGHIỆN VÀ CÁC RỐI LOẠN LIÊN QUAN ĐẾN. F. 292.9(F15.99)', '13.2 Các rối loạn liên quan đến cà phê\n[13.2 Các rối loạn liên quan đến cà phê > 13 CÁC RỐI LOẠN NGHIỆN VÀ CÁC RỐI LOẠN LIÊN QUAN ĐẾN]\n13.2 Các rối loạn liên quan đến cà phê 13.2 Các rối loạn liên quan đến cà phê  13 CÁC RỐI LOẠN NGHIỆN VÀ CÁC RỐI LOẠN LIÊN QUAN ĐẾN. D. Các dấu hiệu hoặc triệu chứng này không phải do một bệnh cơ thể và không được giải thích tốt hơn bằng một rối loạn tâm thần khác, bao gồm cả nhiễm độc một chất khác.HỘI CHỨNG CAI CAFFEINE Tiêu chuẩn chẩn đoán 292.0 (F15.93)', '13.2 Các rối loạn liên quan đến cà phê\n[13.2 Các rối loạn liên quan đến cà phê > 13 CÁC RỐI LOẠN NGHIỆN VÀ CÁC RỐI LOẠN LIÊN QUAN ĐẾN]\n13.2 Các rối loạn liên quan đến cà phê 13.2 Các rối loạn liên quan đến cà phê  13 CÁC RỐI LOẠN NGHIỆN VÀ CÁC RỐI LOẠN LIÊN QUAN ĐẾN. B. Năm hoặc hơn các dấu hiệu hoặc triệu chứng sau đây phát triển trong hoặc ngay sau khi sử dụng caffeine:1. Bồn chồn đứng ngồi không yên.2. Hồi hộp lo lắng.3. Kích thích.4. Mất ngủ.5. Đỏ mặt.6. Đái.7. Rối loạn dạ dày ruột.8. Co giật cơ.9. Dòng suy nghĩ, lời nói không mạch lạc.10.Nhịp tim nhanh hoặc loạn nhịp tim.11.Có các giai đoạn không biết mệt mỏi.12.Kích động tâm thần vận động.83', '13.2 Các rối loạn liên quan đến cà phê\n[13.2 Các rối loạn liên quan đến cà phê > 13 CÁC RỐI LOẠN NGHIỆN VÀ CÁC RỐI LOẠN LIÊN QUAN ĐẾN]\n13.2 Các rối loạn liên quan đến cà phê 13.2 Các rối loạn liên quan đến cà phê  13 CÁC RỐI LOẠN NGHIỆN VÀ CÁC RỐI LOẠN LIÊN QUAN ĐẾN. E. RỐI LOẠN LIÊN QUAN ĐẾN CAFFEINE KHÔNG BIỆT ĐỊNH', '13.2 Các rối loạn liên quan đến cà phê\n[13.2 Các rối loạn liên quan đến cà phê > 13 CÁC RỐI LOẠN NGHIỆN VÀ CÁC RỐI LOẠN LIÊN QUAN ĐẾN]\n13.2 Các rối loạn liên quan đến cà phê 13.2 Các rối loạn liên quan đến cà phê  13 CÁC RỐI LOẠN NGHIỆN VÀ CÁC RỐI LOẠN LIÊN QUAN ĐẾN. D. Các dấu hiệu và triệu chứng trên không liên quan đến các ảnh hưởng sinh lý của một bệnh cơ thể (ví dụ migraine, bệnh do virus) và không được giải thích tốt hơn bằng một rối loạn tâm thần khác, bao gồm cả nhiễm độc và hội chứng cai của một chất khác.', '13.2 Các rối loạn liên quan đến cà phê\n[13.2 Các rối loạn liên quan đến cà phê > 13 CÁC RỐI LOẠN NGHIỆN VÀ CÁC RỐI LOẠN LIÊN QUAN ĐẾN]\n13.2 Các rối loạn liên quan đến cà phê 13.2 Các rối loạn liên quan đến cà phê  13 CÁC RỐI LOẠN NGHIỆN VÀ CÁC RỐI LOẠN LIÊN QUAN ĐẾN. G. Biệt định này vận dụng để thể hiện trong đó đặc điểm các triệu chứng của một rối loạn liên quan đến caffeine gây ra nguy kịch lâm sàng đáng kể hoặc làm suy giảm rõ chức năng xã hội nghề nghiệp,hoặc các chức năng quan trọng khác nhưng không đáp ứng đầy đủ các tiêu chuẩn cho một rối loạnliên quan đến caffeine biệt định nào hoặc bất kỳ rối loạn nào trong nhóm chẩn đoán rối loạn có liên quan đến một chất hoặc các biệt định thêm vào.', '13.2 Các rối loạn liên quan đến cà phê\n[13.2 Các rối loạn liên quan đến cà phê > 13 CÁC RỐI LOẠN NGHIỆN VÀ CÁC RỐI LOẠN LIÊN QUAN ĐẾN]\n13.2 Các rối loạn liên quan đến cà phê 13.2 Các rối loạn liên quan đến cà phê  13 CÁC RỐI LOẠN NGHIỆN VÀ CÁC RỐI LOẠN LIÊN QUAN ĐẾN. A. Có sử dụng caffeine dài ngày.', '13.2 Các rối loạn liên quan đến cà phê\n[13.2 Các rối loạn liên quan đến cà phê > 13 CÁC RỐI LOẠN NGHIỆN VÀ CÁC RỐI LOẠN LIÊN QUAN ĐẾN]\n13.2 Các rối loạn liên quan đến cà phê 13.2 Các rối loạn liên quan đến cà phê  13 CÁC RỐI LOẠN NGHIỆN VÀ CÁC RỐI LOẠN LIÊN QUAN ĐẾN. C. Các dấu hiệu và triệu chứng trong tiêu chuẩn B gây ra nguy kịch lâm sàng đáng kể hoặc làm giảm chức năng xã hội, nghề nghiệp, hoặc các chức năng quan trọng khác.']","Các rối loạn liên quan đến cà phê thuộc loại rối loạn liên quan đến chất (chất gây nghiện). Cụ thể, theo tiêu chuẩn chẩn đoán trong DSM-5, các rối loạn này được phân loại vào nhóm ""13 CÁC RỐI LOẠN NGHIỆN VÀ CÁC RỐI LOẠN LIÊN QUAN ĐẾN"" (13.2 Các rối loạn liên quan đến cà phê). Điều này cho thấy rằng các vấn đề liên quan đến việc sử dụng cà phê được xem xét trong khuôn khổ của các rối loạn liên quan đến chất, bao gồm cả việc lạm dụng, phụ thuộc và các vấn đề khác liên quan đến việc sử dụng caffeine.",Các rối loạn nghiện và các rối loạn liên quan,1.0,1.0,0.67
Rối loạn thần kinh nhận thức được đề cập trong passage thuộc loại nào?,"['14.2.6 Rối loạn thần kinh - nhận thức nhẹ hoặc chủ yếu do mạch máu não\n[14.2.6 Rối loạn thần kinh - nhận thức nhẹ hoặc chủ yếu do mạch máu não > 14.2 Các rối loạn thần kinh - nhận thức chủ yếu và nhẹ (Major and Mild > 14 RỐI LOẠN THẦN KINH NHẬN THỨC]\n14.2.6 Rối loạn thần kinh - nhận thức nhẹ hoặc chủ yếu do mạch máu não 14.2.6 Rối loạn thần kinh - nhận thức nhẹ hoặc chủ yếu do mạch máu não  14.2 Các rối loạn thần kinh - nhận thức chủ yếu và nhẹ (Major and Mild  14 RỐI LOẠN THẦN KINH NHẬN THỨC. A. Rối loạn đáp ứng các tiêu chuẩn rối loạn thần kinh  nhận thức nhẹ hoặc chủ yếu.', '14.2.1 Rối loạn thần kinh- nhận thức chủ yếu(Major Neurocongnitive\n[14.2.1 Rối loạn thần kinh- nhận thức chủ yếu(Major Neurocongnitive > 14.2 Các rối loạn thần kinh - nhận thức chủ yếu và nhẹ (Major and Mild > 14 RỐI LOẠN THẦN KINH NHẬN THỨC]\n14.2.1 Rối loạn thần kinh- nhận thức chủ yếu(Major Neurocongnitive 14.2.1 Rối loạn thần kinh- nhận thức chủ yếu(Major Neurocongnitive  14.2 Các rối loạn thần kinh - nhận thức chủ yếu và nhẹ (Major and Mild  14 RỐI LOẠN THẦN KINH NHẬN THỨC. Disorder)', '14.2.6 Rối loạn thần kinh - nhận thức nhẹ hoặc chủ yếu do mạch máu não\n[14.2.6 Rối loạn thần kinh - nhận thức nhẹ hoặc chủ yếu do mạch máu não > 14.2 Các rối loạn thần kinh - nhận thức chủ yếu và nhẹ (Major and Mild > 14 RỐI LOẠN THẦN KINH NHẬN THỨC]\n14.2.6 Rối loạn thần kinh - nhận thức nhẹ hoặc chủ yếu do mạch máu não 14.2.6 Rối loạn thần kinh - nhận thức nhẹ hoặc chủ yếu do mạch máu não  14.2 Các rối loạn thần kinh - nhận thức chủ yếu và nhẹ (Major and Mild  14 RỐI LOẠN THẦN KINH NHẬN THỨC. C. Trong bệnh sử, kết quả khám và /hoặc hình ảnh thần kinh có bằng chứng về bệnh mạch máu não được xem là phù hợp với suy giảm thần kinh  nhậnthức.', '14.2.6 Rối loạn thần kinh - nhận thức nhẹ hoặc chủ yếu do mạch máu não\n[14.2.6 Rối loạn thần kinh - nhận thức nhẹ hoặc chủ yếu do mạch máu não > 14.2 Các rối loạn thần kinh - nhận thức chủ yếu và nhẹ (Major and Mild > 14 RỐI LOẠN THẦN KINH NHẬN THỨC]\n14.2.6 Rối loạn thần kinh - nhận thức nhẹ hoặc chủ yếu do mạch máu não 14.2.6 Rối loạn thần kinh - nhận thức nhẹ hoặc chủ yếu do mạch máu não  14.2 Các rối loạn thần kinh - nhận thức chủ yếu và nhẹ (Major and Mild  14 RỐI LOẠN THẦN KINH NHẬN THỨC. B. Các đặc điểm lâm sàng luôn đồng hành cùng bệnh căn mạch máu não, thể hiện qua 1 trong 2 điểm dưới đây:1. Khởi phát suy giảm nhận thức luôn gắn với một/hoặc nhiều hơn sự cố tai biến mạch máu não.2. Có bằng chứng cho thấy sự suy giảm thể hiện rõ nét trong chú ý phức tạp (bao gồm cả vận tốc xử lí) và chức năng điều hành  vùng trán.', '14.2.4 Rối loạn thần kinh - nhận thức trán thái dương mức độ nhẹ hoặc chủ\n[14.2.4 Rối loạn thần kinh - nhận thức trán thái dương mức độ nhẹ hoặc chủ > 14.2 Các rối loạn thần kinh - nhận thức chủ yếu và nhẹ (Major and Mild > 14 RỐI LOẠN THẦN KINH NHẬN THỨC]\n14.2.4 Rối loạn thần kinh - nhận thức trán thái dương mức độ nhẹ hoặc chủ 14.2.4 Rối loạn thần kinh - nhận thức trán thái dương mức độ nhẹ hoặc chủ  14.2 Các rối loạn thần kinh - nhận thức chủ yếu và nhẹ (Major and Mild  14 RỐI LOẠN THẦN KINH NHẬN THỨC. B. Rối loạn có khởi phát âm thầm và tiến triển từ từ.', '14.2.4 Rối loạn thần kinh - nhận thức trán thái dương mức độ nhẹ hoặc chủ\n[14.2.4 Rối loạn thần kinh - nhận thức trán thái dương mức độ nhẹ hoặc chủ > 14.2 Các rối loạn thần kinh - nhận thức chủ yếu và nhẹ (Major and Mild > 14 RỐI LOẠN THẦN KINH NHẬN THỨC]\n14.2.4 Rối loạn thần kinh - nhận thức trán thái dương mức độ nhẹ hoặc chủ 14.2.4 Rối loạn thần kinh - nhận thức trán thái dương mức độ nhẹ hoặc chủ  14.2 Các rối loạn thần kinh - nhận thức chủ yếu và nhẹ (Major and Mild  14 RỐI LOẠN THẦN KINH NHẬN THỨC. E. Rối loạn không được giải thích tốt hơn bởi bệnh mạch máu não, bệnh thoái hóa thần kinh khác, tác động của một chất, hoặc bệnh tâm thần, thần kinh hoặc hệ thống khác.Rối loạn thần kinh-nhận thức trán thái dương  chắc chắn được chẩn đoán nếu tồn tại một trong những điều sau, nếu không thì chẩn đoán là rối loạn thần kinh- nhận thức trán thái dươngcó thể.1. Có bằng chứng của đột biến gen gây nên rối loạn thần kinh-nhận thức trán thái dương, từ tiền sử gia đình hoặc xét nghiệm gen.2. Có bằng chứng của thùy trán và/hoặc thùy thái dương không cân đối từ chẩn đoán hình ảnh thần kinh.Rối loạn thần kinh-nhận thức trán thái dươngcó thể được chẩn đoán nếu không có bằng chứng của đột biến gen và chẩn đoán hình ảnh chưa được thực hiện.', '14.2.4 Rối loạn thần kinh - nhận thức trán thái dương mức độ nhẹ hoặc chủ\n[14.2.4 Rối loạn thần kinh - nhận thức trán thái dương mức độ nhẹ hoặc chủ > 14.2 Các rối loạn thần kinh - nhận thức chủ yếu và nhẹ (Major and Mild > 14 RỐI LOẠN THẦN KINH NHẬN THỨC]\n14.2.4 Rối loạn thần kinh - nhận thức trán thái dương mức độ nhẹ hoặc chủ 14.2.4 Rối loạn thần kinh - nhận thức trán thái dương mức độ nhẹ hoặc chủ  14.2 Các rối loạn thần kinh - nhận thức chủ yếu và nhẹ (Major and Mild  14 RỐI LOẠN THẦN KINH NHẬN THỨC. A. Đủ tiêu chuẩn cho rối loạn thần kinh - nhận thức chủ yếu hoặc nhẹ.', '14.2.14 Rối loạn thần kinh - nhận thức nhẹ hoặc chủ yếu do nhiều\n[14.2.14 Rối loạn thần kinh - nhận thức nhẹ hoặc chủ yếu do nhiều > 14.2 Các rối loạn thần kinh - nhận thức chủ yếu và nhẹ (Major and Mild > 14 RỐI LOẠN THẦN KINH NHẬN THỨC]\n14.2.14 Rối loạn thần kinh - nhận thức nhẹ hoặc chủ yếu do nhiều 14.2.14 Rối loạn thần kinh - nhận thức nhẹ hoặc chủ yếu do nhiều  14.2 Các rối loạn thần kinh - nhận thức chủ yếu và nhẹ (Major and Mild  14 RỐI LOẠN THẦN KINH NHẬN THỨC. nguyên nhân (Major or Mild Neurocongnitive Disorder Due to Multiple Etiologies) A. Rối loạn đáp ứng các tiêu chuẩn rối loạn thần kinh  nhận thức nhẹ hoặc chủ yếu. B. Trong bệnh sử, kết quả khám và xét nghiệm cận lâm sàng có bằng chứng cho thấy suy giảm thần kinh  nhậnthức là hậu quả sinh lí bệnh của một số quá trình bệnh căn, ngoại trừ các chất (ví dụ, rối loạn thần kinh - nhận thức do bệnh Alzheimer dẫn đến hậu quả rối loạn thần kinh - nhận thức mạch máu não). Chú ý: nên ưu tiên cho tiêu chuẩn chẩn đoán rối loạn thần kinh - nhận thức đa nguyên nhân do những bệnh cơ thể biệt định trên cơ sở xác định được các bệnh căn cụ thể. C. Rối loạn thần kinh - nhận thức không thể được giải thích tốt hơn bởi một rối loạn tâm thần khác và không xuất hiện trong trạng thái sảng.', '14.2.4 Rối loạn thần kinh - nhận thức trán thái dương mức độ nhẹ hoặc chủ\n[14.2.4 Rối loạn thần kinh - nhận thức trán thái dương mức độ nhẹ hoặc chủ > 14.2 Các rối loạn thần kinh - nhận thức chủ yếu và nhẹ (Major and Mild > 14 RỐI LOẠN THẦN KINH NHẬN THỨC]\n14.2.4 Rối loạn thần kinh - nhận thức trán thái dương mức độ nhẹ hoặc chủ 14.2.4 Rối loạn thần kinh - nhận thức trán thái dương mức độ nhẹ hoặc chủ  14.2 Các rối loạn thần kinh - nhận thức chủ yếu và nhẹ (Major and Mild  14 RỐI LOẠN THẦN KINH NHẬN THỨC. D. Ít tương đối của hiểu biết và trí nhớ và chức năng vận động nhận thức.', '14.2.13 Rối loạn thần kinh - nhận thức nhẹ hoặc chủ yếu do một bệnh cơ\n[14.2.13 Rối loạn thần kinh - nhận thức nhẹ hoặc chủ yếu do một bệnh cơ > 14.2 Các rối loạn thần kinh - nhận thức chủ yếu và nhẹ (Major and Mild > 14 RỐI LOẠN THẦN KINH NHẬN THỨC]\n14.2.13 Rối loạn thần kinh - nhận thức nhẹ hoặc chủ yếu do một bệnh cơ 14.2.13 Rối loạn thần kinh - nhận thức nhẹ hoặc chủ yếu do một bệnh cơ  14.2 Các rối loạn thần kinh - nhận thức chủ yếu và nhẹ (Major and Mild  14 RỐI LOẠN THẦN KINH NHẬN THỨC. thể khác (Major or Mild Neurocognitive Disorder Due to Another Medical Condition) A. Rối loạn đáp ứng các tiêu chuẩn rối loạn thần kinh  nhận thức nhẹ hoặc chủ yếu. B. Trong bệnh sử, kết quả khám và xét nghiệm cận lâm sàng có bằng chứng cho thấy suy giảm thần kinh  nhậnthức là hậu quả sinh lí bệnh của một bệnh cơ thể khác. C. Rối loạn thần kinh - nhận thức không thể được giải thích tốt hơn bởi một rối loạn tâm thần khác hoặc một rối loạn thần kinh - nhận thức biệt định khác (ví dụ, bệnh Alzheimer, nhiễm HIV).']","Rối loạn thần kinh nhận thức được đề cập trong đoạn văn thuộc nhiều loại khác nhau, bao gồm:

- Rối loạn thần kinh - nhận thức chủ yếu (Major Neurocognitive Disorder) và nhẹ (Mild Neurocognitive Disorder) do nhiều nguyên nhân khác nhau, bao gồm cả bệnh mạch máu não (14.2.6) và các bệnh cơ thể khác (14.2.13).
- Rối loạn thần kinh - nhận thức trán thái dương mức độ nhẹ hoặc chủ yếu (14.2.4).
- Rối loạn thần kinh - nhận thức nhẹ hoặc chủ yếu do nhiều nguyên nhân (14.2.14).

Tùy thuộc vào từng loại, các tiêu chuẩn chẩn đoán và đặc điểm lâm sàng có thể khác nhau. Ví dụ, đối với Rối loạn thần kinh - nhận thức nhẹ hoặc chủ yếu do mạch máu não (14.2.6), cần có bằng chứng về bệnh mạch máu não trong bệnh sử, kết quả khám và/hoặc hình ảnh thần kinh, và các đặc điểm lâm sàng như khởi phát suy giảm nhận thức gắn với sự cố tai biến mạch máu não hoặc suy giảm chú ý phức tạp và chức năng điều hành vùng trán.

Để chẩn đoán chính xác, cần xem xét các tiêu chuẩn chẩn đoán cụ thể cho từng loại rối loạn và đánh giá toàn diện các thông tin lâm sàng và xét nghiệm.",chủ yếu và nhẹ (Major and Mild),1.0,1.0,0.0
Ám ảnh cưỡng bức và các rối loạn liên quan thường biểu hiện như thế nào?,"['6.6 Ám ảnh cưỡng bức và các rối loạn liên quan do một chất/thuốc\n[6.6 Ám ảnh cưỡng bức và các rối loạn liên quan do một chất/thuốc > 6 RỐI LOẠN ÁM ẢNH – CƯỠNG BỨC VÀ CÁC RỐI LOẠN LIÊN]\n6.6 Ám ảnh cưỡng bức và các rối loạn liên quan do một chất/thuốc 6.6 Ám ảnh cưỡng bức và các rối loạn liên quan do một chất/thuốc  6 RỐI LOẠN ÁM ẢNH  CƯỠNG BỨC VÀ CÁC RỐI LOẠN LIÊN. A. Các ám ảnh, cưỡng bức, bóc da, nhổ tóc hoặc những hành vi khác tác động lên cơ thể, lặp đi lặp lại hay các triệu chứng khác thể hiện rối loạn ám ảnh- cưỡng bức và các rối loạn liên quan chiếm ưu thế trong bệnh cảnh lâm sàng.', '6.7 Ám ảnh cưỡng bức và các rối loạn liên quan do một bệnh cơ thể khác\n[6.7 Ám ảnh cưỡng bức và các rối loạn liên quan do một bệnh cơ thể khác > 6 RỐI LOẠN ÁM ẢNH – CƯỠNG BỨC VÀ CÁC RỐI LOẠN LIÊN]\n6.7 Ám ảnh cưỡng bức và các rối loạn liên quan do một bệnh cơ thể khác 6.7 Ám ảnh cưỡng bức và các rối loạn liên quan do một bệnh cơ thể khác  6 RỐI LOẠN ÁM ẢNH  CƯỠNG BỨC VÀ CÁC RỐI LOẠN LIÊN. (Obsessive-Compulsive and Related Disorders Due to Another Medical Condition) Mã số: 294.8 (F06.8) A. Các ám ảnh, cưỡng bức, bóc da, nhổ tóc hoặc những hành vi khác tác động lên cơ thể, lặp đi lặp lại hay các triệu chứng khác thể hiện rối loạn ám ảnh- cưỡng bức và các rối loạn liên quan chiếm ưu thế trong bệnh cảnh lâm sàng. B. Trong tiền sử, thăm khám hoặc kết quả xét nghiệm có bằng chứng cho thấy rối loạn là hậu quả sinh lí bệnh trực tiếp của một bệnh cơ thể khác. C. Rối loạn không thể được giải thích tốt hơn bởi một RLTT khác. D. Rối loạn không xảy ra hoàn toàn trong sảng. E. Rối loạn gây ra đau khổ (distress) đáng kể về lâm sàng, tổn thiệt trong các hoạt động xã hội, nghề nghiệp hay các lĩnh vực quan trọng khác. Chẩn đoán phân biệt: - Sảng. - Các triệu chứng hỗn hợp (rối loạn khí sắc, các triệu chứng của OCD và rối loạn liên quan). - OCD và rối loạn liên quan do một chất/thuốc. - Rối loạn lo âu mắc bệnh. - Các đặc điểm của một RLTT khác. - OCD biệt định khác và rối loạn liên quan hoặc OCD không biệt định và rối loạn liên quan.', '6.1 Rối loạn ám ảnh – cưỡng bức\n[6.1 Rối loạn ám ảnh – cưỡng bức > 6 RỐI LOẠN ÁM ẢNH – CƯỠNG BỨC VÀ CÁC RỐI LOẠN LIÊN]\n6.1 Rối loạn ám ảnh  cưỡng bức 6.1 Rối loạn ám ảnh  cưỡng bức  6 RỐI LOẠN ÁM ẢNH  CƯỠNG BỨC VÀ CÁC RỐI LOẠN LIÊN. A. Có ám ảnh,cưỡng bức, hoặc cả hai:Ám ảnh được định nghĩa bởi (1) và (2):1. Những ý nghĩ, sự thôi thúc, những hình ảnh đã trải nghiệm tái diễn, bền vững xuất hiện mang tính cưỡng bức ở cùng một thời điểm của rối loạn và là nguyên nhân gây ra sự lo âu hoặc đau khổ.2. Bệnh nhân cố gắng bỏ qua hoặc ngăn chặn những suy nghĩ, sự thôi thúc, những hình ảnh, hoặc để trung hòa chúng bằng suy nghĩ hoặc hành động khác (ví dụ, bằng cách thực hiện một xung động).Cưỡng bức được xác định bởi (1) và (2):1. Hành vi lặp đi lặp lại (như rửa tay, đặt hàng, kiểm tra), hoạt động tâm thần (ví dụ, cầu nguyện, đếm, lặp đi lặp lại những lời thì thầm) bệnh nhân cảm thấy bị thúc đẩy để hành động đáp lại ám ảnh hoặc theo một quy luật phải được thực hiện một cách cứng nhắc.2. Các hành vi, hoạt động tâm thần nhằm mục đích ngăn ngừa hoặc làm giảm bớt lo âu hoặc đau khổ, hoặc ngăn ngừa một số sự kiện hoặc tình huống đáng sợ; Tuy nhiên, những hành vi, hoạt động tâm thần này không phù hợp với thực tế để trung hòa hoặc dự phòng sự quá mức một cách rõ ràng.Lưu ý: Trẻ nhỏ có thể không thể trình bày rõ mục đích của những hành vi và hoạt động tâm thần này.', '6.6 Ám ảnh cưỡng bức và các rối loạn liên quan do một chất/thuốc\n[6.6 Ám ảnh cưỡng bức và các rối loạn liên quan do một chất/thuốc > 6 RỐI LOẠN ÁM ẢNH – CƯỠNG BỨC VÀ CÁC RỐI LOẠN LIÊN]\n6.6 Ám ảnh cưỡng bức và các rối loạn liên quan do một chất/thuốc 6.6 Ám ảnh cưỡng bức và các rối loạn liên quan do một chất/thuốc  6 RỐI LOẠN ÁM ẢNH  CƯỠNG BỨC VÀ CÁC RỐI LOẠN LIÊN. E. Rối loạn gây ra đau khổ (distress) đáng kể về lâm sàng, tổn thiệt trong các hoạt động xã hội, nghề nghiệp hay các lĩnh vực quan trọng khác.Chú ý: Chẩn đoán này chỉ được đưa ra bổ sung thêm cho chẩn đoán ngộ độc hoặc cai một chất khi các triệu chứng trong tiêu chuẩn A chiếm ưu thế trong bệnh cảnh lâm sàng.Chẩn đoán phân biệt:- Ngộ độc một chất.- OCD và rối loạn liên quan không do một chất.- OCD và rối loạn liên quan do một bệnh cơ thể.- Sảng.57', '6.6 Ám ảnh cưỡng bức và các rối loạn liên quan do một chất/thuốc\n[6.6 Ám ảnh cưỡng bức và các rối loạn liên quan do một chất/thuốc > 6 RỐI LOẠN ÁM ẢNH – CƯỠNG BỨC VÀ CÁC RỐI LOẠN LIÊN]\n6.6 Ám ảnh cưỡng bức và các rối loạn liên quan do một chất/thuốc 6.6 Ám ảnh cưỡng bức và các rối loạn liên quan do một chất/thuốc  6 RỐI LOẠN ÁM ẢNH  CƯỠNG BỨC VÀ CÁC RỐI LOẠN LIÊN. B. Trong tiền sử, thăm khám hoặc kết quả xét nghiệm có bằng chứng cho thấy cả (1) và (2):1. Các triệu chứng ở tiêu chuẩn A xuất hiện trong hoặc ngay sau trạng thái ngộ độc/say hoặc cai hay dùng thuốc.2. Chất/thuốc được dùng có khả năng gây ra những triệu chứng như trong tiêu chuẩn A.', '6.6 Ám ảnh cưỡng bức và các rối loạn liên quan do một chất/thuốc\n[6.6 Ám ảnh cưỡng bức và các rối loạn liên quan do một chất/thuốc > 6 RỐI LOẠN ÁM ẢNH – CƯỠNG BỨC VÀ CÁC RỐI LOẠN LIÊN]\n6.6 Ám ảnh cưỡng bức và các rối loạn liên quan do một chất/thuốc 6.6 Ám ảnh cưỡng bức và các rối loạn liên quan do một chất/thuốc  6 RỐI LOẠN ÁM ẢNH  CƯỠNG BỨC VÀ CÁC RỐI LOẠN LIÊN. D. Rối loạn không xảy ra hoàn toàn trong sảng.', '6.1 Rối loạn ám ảnh – cưỡng bức\n[6.1 Rối loạn ám ảnh – cưỡng bức > 6 RỐI LOẠN ÁM ẢNH – CƯỠNG BỨC VÀ CÁC RỐI LOẠN LIÊN]\n6.1 Rối loạn ám ảnh  cưỡng bức 6.1 Rối loạn ám ảnh  cưỡng bức  6 RỐI LOẠN ÁM ẢNH  CƯỠNG BỨC VÀ CÁC RỐI LOẠN LIÊN. D. Rối loạn này không phải là các triệu chứng của rối loạn tâm thần khác (ví dụ, lo lắng quá mức, như trong rối loạn lo âu; mối bận tâm với hình thể, như trong 53 cơ thể rối loạn sợ dị hình, hành vi ăn nghi thức, như trong các rối loạn ăn uống, cờ bạc, như trong các rối loạn liên quan đến chất gây nghiện ; phổ TTPL và rối loạn tâm thần khác, hoặc của hành vi định hình, như trong rối loạn tự kỷ).Chẩn đoán phân biệt: Rối loạn lo âu.Suy nghĩ tái diễn, hành vi né tránh, lặp đi lặp lại cho yên tâm cũng có thể xảy ra trong các rối loạn lo âu. Tuy nhiên, những suy nghĩ thường xuyên có mặt trong rối loạn lo âu lan tỏa thường là lo ngại về thực tế cuộc sống, trong khi ám ảnh trong thường không liên quan đến mối quan tâm thực sự và có thể bao gồm các nội dungkỳ lạ, không hợp lý, hoặc của một bản chất dường như huyền diệu; Hơn nữa, sự cưỡng bức thường xuất hiện và thường liên quan đến sự ám ảnh. Rối loạn trầm chủ yếu.OCD có thể được phân biệt với sự nghiền ngẫm của rối loạn trầm cảm chủ yếu, trong đó những suy nghĩ thường là cảm xúc tương đồng và không nhất thiết phải cótrải nghiệm như bị áp đặt hoặc đau buồn; Hơn nữa, suy ngẫm không liên kết với cơn xung động cưỡng bức, như là điển hình trong OCD.OCD và rối loạn có liên quan khác.Trong rối loạn biến hình cơ thể, sự ám ảnh và cưỡng bức là có giới han là nhữngmối lo ngại về sự xuất hiện biểu hiện về hình thể;Trong rối loạn nhổ tóc (Trichotillomania), các hành vi cưỡng bức được giới hạn ở hành vi nhổ tóc mà không có ám ảnh. Rối loạn ăn.OCD có thể được phân biệt với chứng chán ăn tâm thần, trong đó ở OCD sự ám ảnh cưỡng bức và không có các mối quan tâm về trọng lượng và thức ăn. Tic (trong rối loạn tic) và vận động rập khuôn.', '6.1 Rối loạn ám ảnh – cưỡng bức\n[6.1 Rối loạn ám ảnh – cưỡng bức > 6 RỐI LOẠN ÁM ẢNH – CƯỠNG BỨC VÀ CÁC RỐI LOẠN LIÊN]\n6.1 Rối loạn ám ảnh  cưỡng bức 6.1 Rối loạn ám ảnh  cưỡng bức  6 RỐI LOẠN ÁM ẢNH  CƯỠNG BỨC VÀ CÁC RỐI LOẠN LIÊN. Tic là một bất ngờ, nhanh chóng, thường xuyên, tái diễn, vận động không theo nhịp, hay phát âm (ví dụ, mắt nhấp nháy, hắng giọng). Các hành động rập khuôn, lặp lại và không có chức năng vận động (gật đầu, lắc thân thể, động tác cắn). Hành vi cưỡng bức phức tạp hơn và để giảm lo âu, hành vi cưỡng bức thường bắt đầu bằng ám ảnh, tic thường có báo trước bằng sự thôi thúc, cảnh báo. Lưu ý một số bệnh nhân có cả OCD và tic. Rối loạn tâm thần.Vài bệnh nhân OCD thường có tự nhận thức bản thân nghèo nàn thậm chí có hoang tưởng tuy nhiên bệnh nhân này có ám ảnh cưỡng bức và không có các triệu chứng khác của TTPL hay rối loạn phân liệt cảm xúc (ví dụ, ảo giác) Rối loạn nhân cách ám ảnh cưỡng bức.RL nhân cách OCD không có các triệu chứng đặc trưng như tư duy xâm nhập, hình ảnh, hành vi lặp lại nhằm đáp ứng với ám ảnh (để giảm lo âu) thay vào đó là một mô hình thích nghi không phù hợp kéo dài, lan tỏa và sự cầu toàn quá mức và kiểm soát cứng nhắc. Nếu bệnh nhân có cả 2 triệu chứng của OCD và rối loạn nhân cách ám ảnh cưỡng bức thì cả 2 chẩn đoán được đặt ra.54', '6.1 Rối loạn ám ảnh – cưỡng bức\n[6.1 Rối loạn ám ảnh – cưỡng bức > 6 RỐI LOẠN ÁM ẢNH – CƯỠNG BỨC VÀ CÁC RỐI LOẠN LIÊN]\n6.1 Rối loạn ám ảnh  cưỡng bức 6.1 Rối loạn ám ảnh  cưỡng bức  6 RỐI LOẠN ÁM ẢNH  CƯỠNG BỨC VÀ CÁC RỐI LOẠN LIÊN. C. Các triệu chứng ám ảnh cưỡng bức là không phải do tác dụng sinh lý của một chất (ví dụ, nghiện ma túy, mộtthuốc) hoặc một bệnh khác.', '15.4.2 Rối loạn nhân cách phụ thuộc\n[15.4.2 Rối loạn nhân cách phụ thuộc > 15.4 Rối loạn nhân cách nhóm C > 15 RỐI LOẠN NHÂN CÁCH]\n15.4.2 Rối loạn nhân cách phụ thuộc 15.4.2 Rối loạn nhân cách phụ thuộc  15.4 Rối loạn nhân cách nhóm C  15 RỐI LOẠN NHÂN CÁCH. - Hành vi phụ thuộc cũng xảy ra ở bệnh nhân có ám ảnh sợ khoảng trống, nhưng có chiều hướng lo âu và hoảng sợ rất cao. 15.4.3Rối loạn nhân cách ám ảnh  cưỡng bức Mã số: 301.4 (F60.5) Luôn luôn kiên trì, luôn đòi hỏi sự hoàn hảo, luôn quan tâm đến kiểm soát mối quan hệ với mọi người, đến hiệu quả công việc, không linh hoạt, không cởi mở, bắt đầu sớm ở tuổi trưởng thành, có 4 (hoặc hơn) các triệu chứng sau: 1. Luôn bận tâm đến chi tiết, quy luật, danh sách, mệnh lệnh, tổ chức hoặc thời khóa biểu, còn điểm chủ yếu của một hoạt động nào đó thì lại bị bỏ rơi. 2. Đòi hỏi phải hoàn thiện mọi việc một cách hoàn hảo (không chấp nhận mọi việc không đạt tiêu chuẩn theo ý của bệnh nhân). 3. Cống hiến quá mức cho công việc và không quan tâm đến giải trí hoặc quan hệ bạn bè (không bao gồm các hoạt động kinh tế có lợi nhuận rõ ràng). 4. ý thức quá cao, quá chu đáo và cứng nhắc về các vấn đề đạo đức hoặc các chuẩn mực (không bao gồm các vấn đề văn hóa, tôn giáo). 5. Không chấp nhận sự mất giá trị của một sự vật nào đó ngay cả khi họ không còn quan tâm đến giá trị thực của sự vật này. 100 6. Không ưa gì bạn bè đồng nghiệp trừ khi họ thực hiện chính xác mọi việc giống như bệnh nhân. 7. Bủn xỉn trong tiêu tiền cho bản thân và cho người khác. Họ luôn xem tiền là của tích lũy đề phòng thảm họa trong tương lai. 8. Luôn cứng nhắc và ương ngạch. Chẩn đoán phân biệt Cần chẩn đoán rối loạn nhân cách thể ám ảnh-cưỡng bức với rối loạn ám ảnh- cưỡng bức. Việc chẩn đoán phân biệt hai rối loạn này đôi khi rất khó khăn.']","Ám ảnh cưỡng bức và các rối loạn liên quan thường biểu hiện thông qua các triệu chứng như ám ảnh, cưỡng bức, bóc da, nhổ tóc hoặc những hành vi khác tác động lên cơ thể, lặp đi lặp lại. Theo tiêu chuẩn A của chẩn đoán 6.1 Rối loạn ám ảnh – cưỡng bức, ám ảnh được định nghĩa bởi những ý nghĩ, sự thôi thúc, những hình ảnh đã trải nghiệm tái diễn, bền vững xuất hiện mang tính cưỡng bức và gây ra sự lo âu hoặc đau khổ. Cưỡng bức được xác định bởi hành vi lặp đi lặp lại hoặc hoạt động tâm thần nhằm mục đích ngăn ngừa hoặc làm giảm bớt lo âu hoặc đau khổ.

Cụ thể, các triệu chứng của ám ảnh cưỡng bức bao gồm:

- Ám ảnh: Những ý nghĩ, sự thôi thúc, những hình ảnh đã trải nghiệm tái diễn, bền vững xuất hiện mang tính cưỡng bức và gây ra sự lo âu hoặc đau khổ.
- Cưỡng bức: Hành vi lặp đi lặp lại hoặc hoạt động tâm thần nhằm mục đích ngăn ngừa hoặc làm giảm bớt lo âu hoặc đau khổ.

Theo tiêu chuẩn A của chẩn đoán 6.6 Ám ảnh cưỡng bức và các rối loạn liên quan do một chất/thuốc, các triệu chứng này chiếm ưu thế trong bệnh cảnh lâm sàng và gây ra đau khổ đáng kể về lâm sàng, tổn thiệt trong các hoạt động xã hội, nghề nghiệp hay các lĩnh vực quan trọng khác.","Các ám ảnh, cưỡng bức, bóc da, nhổ tóc hoặc những hành vi khác tác động lên cơ thể, lặp đi lặp lại",1.0,1.0,0.46
"Theo tiêu chuẩn chẩn đoán, thời gian kéo dài của trạng thái mà các triệu chứng gây ra ở người bệnh Rối loạn triệu chứng cơ thể thường là bao lâu?","['9.1 Rối loạn triệu chứng cơ thể (Somatic Symptom Disorder)\n[9.1 Rối loạn triệu chứng cơ thể (Somatic Symptom Disorder) > 9 RỐI LOẠN TRIỆU CHỨNG CƠ THỂ VÀ CÁC RỐI LOẠN LIÊN]\n9.1 Rối loạn triệu chứng cơ thể (Somatic Symptom Disorder) 9.1 Rối loạn triệu chứng cơ thể (Somatic Symptom Disorder)  9 RỐI LOẠN TRIỆU CHỨNG CƠ THỂ VÀ CÁC RỐI LOẠN LIÊN. Mã số: 300.82 (F45.1) A. Ít nhất 1 triệu chứng cơ thể làm bệnh nhân khó chịu, hoặc làm gián đoạn cuộc sống hằng ngày. B. Những hành vi, cảm giác, ý nghĩ quá mức về các triệu chứng cơ thể hoặc triệu chứng liên quan đến sức khỏe, dễ nhận thấy bởi ít nhất 1 biểu hiện sau: 1. Những ý nghĩ dai dẳng và không tương xứng về mức độ nghiêm trọng của các triệu chứng. 2. Lo lắng quá mức một cách dai dẳng về sức khỏe hay về các triệu chứng cơ thể. 3. Mất quá nhiều công sức và thời gian cho các triệu chứng nói trên hay các vấn đề có liên quan đến sức khỏe. C. Mặc dù các triệu chứng cơ thể không còn nhưng trạng thái mà các triệu chứng gây ra vẫn kéo dài dai dẳng ở người bệnh (thường ít nhất 6 tháng). 70 Biệt định nếu: - Triệu chứng đau có trước: dành cho các cá nhân có triệu chứng dạng cơ thể bao gồm cả triệu chứng đau. - Sự dai dẳng: Khi các triệu chứng nghiêm trọng kéo dài ít nhất 6 tháng. Biệt định theo mức độ hiện tại: - Nhẹ: Chỉ 1 triệu chứng trong tiêu chuẩn B. - Vừa: Ít nhất 2 triệu chứng trong tiêu chuẩn B. - Nặng: Ít nhất 2 triệu chứng trong tiêu chuẩn B kèm theo bệnh nhân phàn nàn rất nhiều (Hoặc chỉ cần 1 triệu chứng rất nghiêm trọng). Chẩn đoán phân biệt: - Bệnh khác: Đau xơ cơ, hội chứng ruột kích thích, đái tháo đường, bệnh tim. - Rối loạn hoảng sợ. - Rối loạn lo âu lan tỏa. - Rối loạn trầm cảm. - Rối loạn lo âu bệnh lý. - Rối loạn chuyển dạng. - Rối loạn sợ biến dạng cơ thể. - Rối loạn ám ảnh cưỡng bức.', '9.6 Rối loạn triệu chứng cơ thể biệt định khác (Other Specified Somatic\n[9.6 Rối loạn triệu chứng cơ thể biệt định khác (Other Specified Somatic > 9 RỐI LOẠN TRIỆU CHỨNG CƠ THỂ VÀ CÁC RỐI LOẠN LIÊN]\n9.6 Rối loạn triệu chứng cơ thể biệt định khác (Other Specified Somatic 9.6 Rối loạn triệu chứng cơ thể biệt định khác (Other Specified Somatic  9 RỐI LOẠN TRIỆU CHỨNG CƠ THỂ VÀ CÁC RỐI LOẠN LIÊN. Symptom and Related Disorders) Mã số: 300.89 (F45.8) Mục này đề cập tới các triệu chứng dạng cơ thể và các triệu chứng liên quan gây nên các triệu chứng lâm sàng gây khó chịu nhiều cho bệnh nhân, hoặc làm giảm sút đáng kể các chức năng xã hội, nghề nghiệp và một số chức năng ở các lĩnh vực quan trọng khác. Các ví dụ cho  biệt định khác bao gồm: 1. Rối loạn triệu chứng dạng cơ thể ngắn: Thời gian triệu chứng ít hơn 6 tháng. 2. Rối loạn lo âu bệnh lý ngắn: Thời gian triệu chứng ít hơn 6 tháng. 3. Rối loạn lo âu bệnh lý không có các hành vi lo lắng quá mức về sức khỏe: Không có tiêu chuẩn D. 4. Hiện tượng thụ thai giả.', '2.5 TTPL\n[2.5 TTPL > 2 RỐI LOẠN PHỔ TÂM THẦN PHÂN LIỆT VÀ CÁC RỐI LOẠN]\n2.5 TTPL 2.5 TTPL  2 RỐI LOẠN PHỔ TÂM THẦN PHÂN LIỆT VÀ CÁC RỐI LOẠN. C. Các biểu hiện của rối loạn liên tục kéo dài ít nhất 6 tháng. Thời gian 6 tháng bao gồm tối thiểu 1 tháng ( Hoặc ít hơn nếu được điều trị thành công) của triệu chứng trong tiêu chuẩn A (các triệu chứng của giai doạn cấp) và thời gian của các triệu chứng tiền triệu hoặc triệu chứng di chứng. Trong suốt giai đoạn tiền triệu hoặc di chứng, biểu hiện của rối loạn có thể chỉ là các triệu chứng âm tính hoặc 2 hoặc nhiều hơn các triệu chứng của tiêu chuẩn A nhưng ở dạng ít rõ ràng (ví dụ niềm tin kỳ lạ, trải nghiệm tri giác không bình thường).', '9.3 Rối loạn phân ly (Rối loạn thần kinh chức năng) (Conversion\n[9.3 Rối loạn phân ly (Rối loạn thần kinh chức năng) (Conversion > 9 RỐI LOẠN TRIỆU CHỨNG CƠ THỂ VÀ CÁC RỐI LOẠN LIÊN]\n9.3 Rối loạn phân ly (Rối loạn thần kinh chức năng) (Conversion 9.3 Rối loạn phân ly (Rối loạn thần kinh chức năng) (Conversion  9 RỐI LOẠN TRIỆU CHỨNG CƠ THỂ VÀ CÁC RỐI LOẠN LIÊN. Disorder/Functional Neurological Symtom Disorder) A. Ít nhất 1 triệu chứng chức năng cảm giác hay vận động chủ ý bị thay đổi. B. Có bằng chứng lâm sàng về sự không thích hợp giữa triệu chứng và thần kinh tiếp nhận hoặc bệnh lý. C. Triệu chứng hay sự giảm sút chức năng này không phải do bệnh hay rối loạn tâm thần khác. D. Triệu chứng hay sự giảm sút chức năng gây ra các triệu chứng lâm sàng làm bệnh nhân khó chịu nhiều hoặc làm giảm sút đáng kể các chức năng xã hội, nghề nghiệp và một số lĩnh vực quan trọng khác. Biệt định nếu: - Yếu hoặc liệt. - Cử động bất thương. - Triệu chứng khó nuốt. - Rối loạn lời nói. - Cơn co giật. - Giảm hoặc mất cảm giác. - Triệu chứng cảm giác đặc biệt. - Triệu chứng hỗn hợp. Biệt định nếu: - Thời kỳ cấp tính: Các triệu chứng kéo dài ít hơn 6 tháng. 72 - Dai dẳng: Các triệu chứng kéo dài ít nhất 6 tháng. Biệt định nếu: - Có căng thẳng tâm lý - Không có căng thẳng tâm lý.', '2.4 Rối loạn dạng phân liệt (Schizophrenifom Disorder)\n[2.4 Rối loạn dạng phân liệt (Schizophrenifom Disorder) > 2 RỐI LOẠN PHỔ TÂM THẦN PHÂN LIỆT VÀ CÁC RỐI LOẠN]\n2.4 Rối loạn dạng phân liệt (Schizophrenifom Disorder) 2.4 Rối loạn dạng phân liệt (Schizophrenifom Disorder)  2 RỐI LOẠN PHỔ TÂM THẦN PHÂN LIỆT VÀ CÁC RỐI LOẠN. Mã số: 295.40 (F20.81) A. Có hai (hay nhiều hơn) các triệu chứng sau, mỗi triệu chứng hiện diện một thời gian đáng kể trong 1 tháng (hoặc ít hơn nếu được điều trị thành công). Ít nhất phải có một trong 3 triệu chứng (1), (2) hoặc (3): (1) Các hoang tưởng. (2) Các ảo giác. (3) Ngôn ngữ thanh xuân (ví dụ như tư duy không liên quan hoặc hổ lốn). (4) Hành vi thanh xuân hoặc hành vi căng trương lực. (5) Các triệu chứng âm tính (ví dụ như giảm thể hiện cảm xúc hoặc giảm, mất ý chí). B.Một giai đoạn tổn thương kéo dài ít nhất 1 tháng nhưng ngắn hơn 6 tháng. Khi cần đặt chẩn đoán này mà không cần đợi hồi phục, chẩn đoán đó là tạm thời. 15 C. Rối loạn phân liệt cảm xúc và rối loạn trầm cảm hoặc lưỡng cực với triệu chứng loạn thần phải được loại trừ bởi vì (1) không có giai đoạn hưng cảm hoặc trầm cảm xảy ra đồng thời với các triệu chứng giai đoạn cấp hoặc (2) nếu giai đoạn cảm xúc xảy ra trong giai đoạn cấp, chúng chỉ xuất hiện một thời gian ngắn trong tổng thời gian cấp tính hoặc di chứng của rối loạn. D. Rối loạn không có thể quy do các ảnh hưởng sinh lý của các chất (ví dụ như chất ma túy hoặc các thuốc) hoặc do các tình trạng bệnh cơ thể khác. Chẩn đoán phân biệt: - Các rối loạn tâm thần và bệnh cơ thể khác. - Rối loạn loạn thần ngắn.', '2.3 Rối loạn loạn thần ngắn (Brief Psychotic Disorder)\n[2.3 Rối loạn loạn thần ngắn (Brief Psychotic Disorder) > 2 RỐI LOẠN PHỔ TÂM THẦN PHÂN LIỆT VÀ CÁC RỐI LOẠN]\n2.3 Rối loạn loạn thần ngắn (Brief Psychotic Disorder) 2.3 Rối loạn loạn thần ngắn (Brief Psychotic Disorder)  2 RỐI LOẠN PHỔ TÂM THẦN PHÂN LIỆT VÀ CÁC RỐI LOẠN. Mã số 298.8 (F23) 14 A. Có 1 hoặc nhiều hơn các triệu chứng sau. Ít nhất phải có 1 trong các triệu chứng (1), (2) hoặc (3): (1). Các hoang tưởng (2). Các ảo giác (3). Ngôn ngữ thanh xuân (ví dụ như tư duy không liên quan hoặc hổ lốn) (4) Hành vi thanh xuân hoặc hành vi căng trương lực Lưu ý: Không được coi là triệu chứng nếu như đó là một phần đáp ứng phổ biến của nền văn hoá B. Độ dài của rối loạn ít nhất là 1 ngày nhưng ít hơn 1 tháng, các chức năng trở lại mức độ như trước khi bị bệnh. C. Rối loạn không giải thích được là do trầm cảm hoặc RLLC có loạn thần hoặc các RL loạn thần khác như TTPL hoặc căng trương lực và không phải là hậu quả trực tiếp của chất gây loạn thần (ví dụ ma tuý, thuốc) hoặc của một bệnh cơ thể. Được biệt định nếu như: - Có chấn thương tâm lý rõ (loạn thần phản ứng ngắn): nếu như triệu chứng xuất hiện rõ ràng một thời gian ngắn sau khi bị các sự kiện, đơn độc hoặc phối hợp với nhau, được coi là stress cho hầu hết mọi người trong cùng một nền văn hoá. - Không có stress rõ ràng: nếu như các triệu chứng loạn thần không xuất hiện một sau thời gian ngắn, rõ ràng như một đáp ứng lại các sự kiện đơn độc hoặc cùng nhau, là stress cho hầu hết mọi người trong cùng nền văn hoá. - Khởi phát sau đẻ: nếu như khởi phát xuất hiện trong vòng 4 tuần sau đẻ. Chẩn đoán phân biệt: - Các bệnh cơ thể khác. - Các rối loạn liên quan đến 1 chất. - Các rối loạn trầm cảm và lưỡng cực. - Các rối loạn loạn thần khác. - Giả bệnh. - Các rối loạn nhân cách.', '7.5 Các rối loạn thích ứng (Adjustment Disorders)\n[7.5 Các rối loạn thích ứng (Adjustment Disorders) > 7 CÁC RỐI LOẠN LIÊN QUAN ĐẾN CHẤN THƯƠNG VÀ STRESS]\n7.5 Các rối loạn thích ứng (Adjustment Disorders) 7.5 Các rối loạn thích ứng (Adjustment Disorders)  7 CÁC RỐI LOẠN LIÊN QUAN ĐẾN CHẤN THƯƠNG VÀ STRESS. A. Các triệu chứng rối loạn về cảm xúc hoặc hành vi trước một tác nhân gây sang chấn xác định xảy ra trong vòng 3 tháng kể từ khi bắt đầu có sang chấn. B. Các triệu chứng hoặc hành vi có ý nghĩa lâm sàng, được biểu hiện bằng một hoặc cả hai tình huống sau: 1. Không tương xứng với mức độ nghiêm trọng hay cường độ của sang chấn, có tính đến bối cảnh bên ngoài, các yếu tố văn hóa ảnh hưởng đến mức độ nghiêm trọng của triệu chứng. 69 2. Sự suy giảm đáng kể các chức năng xã hội, nghề nghiệp hoặc chức năng quan trọng khác. C. Các rối loạn liên quan đến sang chấn không đáp ứng các tiêu chuẩn cho một rối loạn tâm thần và không phải là một đợt cấp của một triệu chứng tồn tại từ trước. D. Các triệu chứng không phải là những biểu hiện của có tang thông thường. E. Khi tác nhân gây sang chấn hoặc hậu quả của nó đã chấm dứt, các triệu chứng không kéo dài trên 6 tháng. Chẩn đoán phân biệt: - Rối loạn trầm cảm chủ yếu. - PTSD. - Các rối loạn nhân cách. - Các yếu tố tâm lý ảnh hưởng đến một bệnh cơ thể khác. - Các phản ứng stress thông thường.', '2.5 TTPL\n[2.5 TTPL > 2 RỐI LOẠN PHỔ TÂM THẦN PHÂN LIỆT VÀ CÁC RỐI LOẠN]\n2.5 TTPL 2.5 TTPL  2 RỐI LOẠN PHỔ TÂM THẦN PHÂN LIỆT VÀ CÁC RỐI LOẠN. A. Có hai (hay nhiều hơn) các triệu chứng sau, mỗi triệu chứng hiện diện một thời gian đáng kể trong 1 tháng (hoặc ít hơn nếu được điều trị thành công). Ít nhất phải có một trong 3 triệu chứng (1), (2) hoặc (3):(1) Các hoang tưởng.(2) Các ảo giác.(3) Ngôn ngữ thanh xuân (ví dụ như tư duy không liên quan hoặc hổ lốn)(4) Hành vi thanh xuân hoặc hành vi căng trương lực.(5) Các triệu chứng âm tính (ví dụ như biểu hiện cảm xúc giảm hoặc giảm, mất ý chí).', '3.3 Rối loạn khí sắc chu kì\n[3.3 Rối loạn khí sắc chu kì > 3 RỐI LOẠN LƯỠNG CỰC VÀ CÁC RỐI LOẠN LIÊN QUAN]\n3.3 Rối loạn khí sắc chu kì 3.3 Rối loạn khí sắc chu kì  3 RỐI LOẠN LƯỠNG CỰC VÀ CÁC RỐI LOẠN LIÊN QUAN. A. Thời gian ít nhất 2 năm, (đối với trẻ em hoặc vị thành niên ít nhất là 1 năm)biểu hiện một số giai đoạn có các triệu chứng hưng cảm nhẹ nhưng chưa đáp ứng tiêu chuẩn chẩn đoán giai đoạn hưng cảm nhẹ và một số giai đoạn có các 31 triệu chứng trầm cảm nhưng không đủ thoả mãn các tiêu chuẩn cho một giai đoạn trầm cảm chủ yếu.', '3.5 Rối loạn lưỡng cực do một bệnh cơ thể khác\n[3.5 Rối loạn lưỡng cực do một bệnh cơ thể khác > 3 RỐI LOẠN LƯỠNG CỰC VÀ CÁC RỐI LOẠN LIÊN QUAN]\n3.5 Rối loạn lưỡng cực do một bệnh cơ thể khác 3.5 Rối loạn lưỡng cực do một bệnh cơ thể khác  3 RỐI LOẠN LƯỠNG CỰC VÀ CÁC RỐI LOẠN LIÊN QUAN. D. Các triệu chứng hỗn hợp không xảy ra do những tác động sinh lý của một chất nào đó (ví dụ như một loại thuốc lạm dụng, một loại thuốc uống điều trị).Lưu ý: Các đặc điểm hỗn hợp đi kèm với một giai đoạn trầm cảm điển hình được cho là một nhân tố nguy cơ đáng kể dẫn tới hình thành rối loạn lưỡng cực I hoặc II. Chính vì vậy, việc có ích đối với lâm sàng là lưu ý sự hiện diện của các ghi chú này để lên kế hoạch điều trị và giám sát đáp ứng với điều trị.36 Với chu kỳ nhanh (có thể áp dụng cho rối loạn lưỡng cực I và II): hiện diện của ít nhất 4 giai đoạn khí sắc trong 12 tháng vừa qua thỏa mãn tiêu chí giai đoạn hưng cảm, hưng cảm nhẹ, hay trầm cảm điển hình.Lưu ý: Các giai đoạn được phân ranh giới bởi hoặc là sự thuyên giảm một phần hoặc toàn bộ của ít nhất 2 tháng, hoặc chuyển sang một giai đoạn của cực đối lập (ví dụ từ giai đoạn trầm cảm điển hình sang giai đoạn hưng cảm).Lưu ý: Đặc điểm thiết yếu của rối loạn lưỡng cực chu kỳ nhanh là sự xảy ra ít nhất bốn giai đoạn khí sắc trong 12 tháng vừa qua. Các giai đoạn này có thể diễn ra với bất kỳ sự kết hợp hoặc thứ tự nào. Các giai đoạn phải thỏa mãn tiêu chí về khoảng thời gian và số triệu chứng của giai đoạn trầm cảm điển hình, hưng cảm hay hưng cảm nhẹ, và phải được phân ranh giới bởi hoặc một giai đoạn thuyên giảm hoàn toàn hoặc chuyển sang một giai đoạn của cực đối lập. Những giai đoạn hưng cảm và hưng cảm nhẹ được coi là cùng một cực. Ngoại trừ việc diễn ra thường xuyên hơn thì những giai đoạn diễn ra theo kiểu chu kỳ nhanh không khác với những giai đoạn không diễn ra theo kiểu chu kỳ nhanh.']","Theo tiêu chuẩn chẩn đoán, thời gian kéo dài của trạng thái mà các triệu chứng gây ra ở người bệnh Rối loạn triệu chứng cơ thể (Somatic Symptom Disorder) thường là ít nhất 6 tháng. Điều này được quy định trong tiêu chuẩn C của chẩn đoán Rối loạn triệu chứng cơ thể, cụ thể là: ""Mặc dù các triệu chứng cơ thể không còn nhưng trạng thái mà các triệu chứng gây ra vẫn kéo dài dai dẳng ở người bệnh (thường ít nhất 6 tháng)"".",ít nhất 6 tháng,1.0,1.0,0.8
Những triệu chứng nào thường xuất hiện trong giai đoạn hưng cảm nhẹ của rối loạn lưỡng cực I?,"['3.1.2 Giai đoạn hưng cảm nhẹ\n[3.1.2 Giai đoạn hưng cảm nhẹ > 3.1 Rối loạn lưỡng cực I (Bipolar I Disorder) > 3 RỐI LOẠN LƯỠNG CỰC VÀ CÁC RỐI LOẠN LIÊN QUAN]\n3.1.2 Giai đoạn hưng cảm nhẹ 3.1.2 Giai đoạn hưng cảm nhẹ  3.1 Rối loạn lưỡng cực I (Bipolar I Disorder)  3 RỐI LOẠN LƯỠNG CỰC VÀ CÁC RỐI LOẠN LIÊN QUAN. F. Các triệu chứng trên không phải là kết quả sinh lý trực tiếp của một chất (như lạm dụng ma túy, một thuốc hặc một điều trịkhác).Lưu ý: Các giai đoạn giống với các giai đoạn hưng cảm nhẹ rõ ràng là hậu quả của điều trị chống trầm cảm (thuốc, sốc điện ) nhưng tồn tại dai dẳng đầy đủ ở các mức độ ngoài tác dụng sinh lý của điều trị đủ bằng chứng cho chẩn đoán một giai đoạn hưng cảm nhẹ. Tuy nhiên cần thận trọng để chỉ ra 1 hoặc 2 triệu chứng (đặc biệt là tăng kích thích,cáu kỉnh, hoặckích độngsau khi sử dụngthuốc chống trầm cảm) không được coi làđủđể chẩn đoánmộtgiai đoạn hưng cảm nhẹ, cũng khôngnhất thiết phải làtạng lưỡng cực.Lưu ý: Mục A-F cấu thành lên hội chứng hưng cảm nhẹ. Giai đoạn hưng cảm nhẹ thường gặp ở rối loạn cảm xúc lưỡng cực I nhưng không yêu cầu nhất thiết chẩn đoán rối loạn cảm xúc lưỡng cực I.', '3.1.2 Giai đoạn hưng cảm nhẹ\n[3.1.2 Giai đoạn hưng cảm nhẹ > 3.1 Rối loạn lưỡng cực I (Bipolar I Disorder) > 3 RỐI LOẠN LƯỠNG CỰC VÀ CÁC RỐI LOẠN LIÊN QUAN]\n3.1.2 Giai đoạn hưng cảm nhẹ 3.1.2 Giai đoạn hưng cảm nhẹ  3.1 Rối loạn lưỡng cực I (Bipolar I Disorder)  3 RỐI LOẠN LƯỠNG CỰC VÀ CÁC RỐI LOẠN LIÊN QUAN. B. Trong giai đoạn của rối loạn khí sắc và tăng năng lượng hoặc hoạt động, có ba (hoặc nhiều hơn) trong số các triệu chứng sau (bốn triệu chứng nếu khí sắc chỉ là kích thích) tồn tại dai dẳng, gây chú ý bởi sự thay đổi hành vi bình thường và biểu hiện rõ ràng.1. Tự đánh giá bản thân cao hoặc tự cao.2. Giảm nhu cầu ngủ (ví dụ cảm thấy thoải mái chỉ sau ngủ 3 giờ)3. Nói nhiều hơn bình thường hoặc cảm thấy có áp lực phải nói liên tục.4. Bùng nổ ý nghĩ hoặc biểu hiện của tư duy phi tán 205. Thiếu tập trung hay đãng trí( sự chú ý dễ bị lôi cuốn bởi các kích thích từ môi trường bên ngoàikhông quan trọng hoặc không liên quan) được kể lại hoặc bị quan sát thấy.6. Tăng hoạt động có mục đích (như hoạt động xã hội, làm việc, học tập, hoặc tình dục) hoặc kích động tâm thần vận động.7. Bị lôi cuốn quá mức vào các hoạt động có nguy cao gây các hậu quả đau đớn (như mua sắm quá nhiều, hoạt động tình dục bừa bãi hoặc đầu tư buôn bán bất lợi).', '3.2.1 Giai đoạn hưng cảm nhẹ\n[3.2.1 Giai đoạn hưng cảm nhẹ > 3.2 Rối loạn lưỡng cực II > 3 RỐI LOẠN LƯỠNG CỰC VÀ CÁC RỐI LOẠN LIÊN QUAN]\n3.2.1 Giai đoạn hưng cảm nhẹ 3.2.1 Giai đoạn hưng cảm nhẹ  3.2 Rối loạn lưỡng cực II  3 RỐI LOẠN LƯỠNG CỰC VÀ CÁC RỐI LOẠN LIÊN QUAN. F. Các triệu chứng trên không phải là kết quả sinh lý trực tiếp của một chất (như lạm dụng ma túy, một thuốc hoặc một điều trị khác).Lưu ý: Các giai đoạn giống với các giai đoạn hưng cảm nhẹ rõ ràng là hậu quả của điều trị chống trầm cảm (thuốc, sốc điện ) nhưng tồn tại dai dẳng đầy đủ ở các mức độ ngoài tác dụng sinh lý của điều trị đủ bằng chứng cho chẩn đoán một giai đoạn hưng cảm nhẹ. Tuy nhiên cần thận trọng để chỉ ra 1 hoặc 2 triệu chứng (đặc biệt là tăng kích thích,cáu kỉnh, hoặckích độngsau khi sử dụngthuốc chống trầm cảm) không được coi làđủđể chẩn đoánmộtgiai đoạn hưng cảm nhẹ, cũng khôngnhất thiết phải làtạng lưỡng cực.23 Lưu ý: Mục A-F cấu thành lên hội chứng hưng cảm nhẹ. Giai đoạn hưng cảm nhẹ thường gặp ở rối loạn cảm xúc lưỡng cực I nhưng không yêu cầu nhất thiết chẩn đoán rối loạn cảm xúc lưỡng cực I.', '3.2.1 Giai đoạn hưng cảm nhẹ\n[3.2.1 Giai đoạn hưng cảm nhẹ > 3.2 Rối loạn lưỡng cực II > 3 RỐI LOẠN LƯỠNG CỰC VÀ CÁC RỐI LOẠN LIÊN QUAN]\n3.2.1 Giai đoạn hưng cảm nhẹ 3.2.1 Giai đoạn hưng cảm nhẹ  3.2 Rối loạn lưỡng cực II  3 RỐI LOẠN LƯỠNG CỰC VÀ CÁC RỐI LOẠN LIÊN QUAN. B. Trong giai đoạn của rối loạn khí sắc và tăng năng lượng hoặc hoạt động, có ba (hoặc nhiều hơn) trong số các triệu chứng sau (bốn triệu chứng nếu khí sắc chỉ là kích thích) tồn tại dai dẳng, gây chú ý bởi sự thay đổi hành vi bình thường và biểu hiện rõ ràng.1. Tự đánh giá bản than cao hoặc tự cao.2. Giảm nhu cầu ngủ (ví dụ cảm thấy thoải mái chỉ sau ngủ 3 giờ)3. Nói nhiều hơn bình thường hoặc cảm thấy có áp lực phải nói liên tục.4. Bùng nổ ý nghĩ hoặc biểu hiện của tư duy phi tán5. Thiếu tập trung hay đãng trí ( sự chú ý dễ bị lôi cuốn bởi các kích thích từ môi trường bên ngoài không quan trọng hoặc không liên quan) được kể lại hoặc bị quan sát thấy.6. Tăng hoạt động có mục đích (như hoạt động xã hội, làm việc, học tập, hoặc tình dục) hoặc kích động tâm thần vận động.7. Bị lôi cuốn quá mức vào các hoạt động có nguy cao gây các hậu quả đau đớn (như mua sắm quá nhiều, hoạt động tình dục bừa bãi hoặc đầu tư buôn bán bất lợi).', '3.2.1 Giai đoạn hưng cảm nhẹ\n[3.2.1 Giai đoạn hưng cảm nhẹ > 3.2 Rối loạn lưỡng cực II > 3 RỐI LOẠN LƯỠNG CỰC VÀ CÁC RỐI LOẠN LIÊN QUAN]\n3.2.1 Giai đoạn hưng cảm nhẹ 3.2.1 Giai đoạn hưng cảm nhẹ  3.2 Rối loạn lưỡng cực II  3 RỐI LOẠN LƯỠNG CỰC VÀ CÁC RỐI LOẠN LIÊN QUAN. C. Giai đoạn này đi kèm với sự thay đổi rõ rệt trong hoạt động của người bệnh mà không phải đặc trưng khi không có triệu chứng.', '3.5 Rối loạn lưỡng cực do một bệnh cơ thể khác\n[3.5 Rối loạn lưỡng cực do một bệnh cơ thể khác > 3 RỐI LOẠN LƯỠNG CỰC VÀ CÁC RỐI LOẠN LIÊN QUAN]\n3.5 Rối loạn lưỡng cực do một bệnh cơ thể khác 3.5 Rối loạn lưỡng cực do một bệnh cơ thể khác  3 RỐI LOẠN LƯỠNG CỰC VÀ CÁC RỐI LOẠN LIÊN QUAN. D. Các triệu chứng hỗn hợp không xảy ra do những tác động sinh lý của một chất nào đó (ví dụ như một loại thuốc lạm dụng, một loại thuốc uống điều trị).Lưu ý: Các đặc điểm hỗn hợp đi kèm với một giai đoạn trầm cảm điển hình được cho là một nhân tố nguy cơ đáng kể dẫn tới hình thành rối loạn lưỡng cực I hoặc II. Chính vì vậy, việc có ích đối với lâm sàng là lưu ý sự hiện diện của các ghi chú này để lên kế hoạch điều trị và giám sát đáp ứng với điều trị.36 Với chu kỳ nhanh (có thể áp dụng cho rối loạn lưỡng cực I và II): hiện diện của ít nhất 4 giai đoạn khí sắc trong 12 tháng vừa qua thỏa mãn tiêu chí giai đoạn hưng cảm, hưng cảm nhẹ, hay trầm cảm điển hình.Lưu ý: Các giai đoạn được phân ranh giới bởi hoặc là sự thuyên giảm một phần hoặc toàn bộ của ít nhất 2 tháng, hoặc chuyển sang một giai đoạn của cực đối lập (ví dụ từ giai đoạn trầm cảm điển hình sang giai đoạn hưng cảm).Lưu ý: Đặc điểm thiết yếu của rối loạn lưỡng cực chu kỳ nhanh là sự xảy ra ít nhất bốn giai đoạn khí sắc trong 12 tháng vừa qua. Các giai đoạn này có thể diễn ra với bất kỳ sự kết hợp hoặc thứ tự nào. Các giai đoạn phải thỏa mãn tiêu chí về khoảng thời gian và số triệu chứng của giai đoạn trầm cảm điển hình, hưng cảm hay hưng cảm nhẹ, và phải được phân ranh giới bởi hoặc một giai đoạn thuyên giảm hoàn toàn hoặc chuyển sang một giai đoạn của cực đối lập. Những giai đoạn hưng cảm và hưng cảm nhẹ được coi là cùng một cực. Ngoại trừ việc diễn ra thường xuyên hơn thì những giai đoạn diễn ra theo kiểu chu kỳ nhanh không khác với những giai đoạn không diễn ra theo kiểu chu kỳ nhanh.', '3.2.2 Giai đoạn trầm cảm chủ yếu\n[3.2.2 Giai đoạn trầm cảm chủ yếu > 3.2 Rối loạn lưỡng cực II > 3 RỐI LOẠN LƯỠNG CỰC VÀ CÁC RỐI LOẠN LIÊN QUAN]\n3.2.2 Giai đoạn trầm cảm chủ yếu 3.2.2 Giai đoạn trầm cảm chủ yếu  3.2 Rối loạn lưỡng cực II  3 RỐI LOẠN LƯỠNG CỰC VÀ CÁC RỐI LOẠN LIÊN QUAN. Những giai đoạn trầm cảm điển hình tái diễn là thường xuyên hơn và kéo dài hơn so với những giai đoạn ở rối loạn lưỡng cực I.Những người mắc rối loạn lưỡng cực II thường đến với nhà lâm sàng trong giai đoạn trầm cảm điển hình và thường không than phiền lúc ban đầu là hưng cảm nhẹ. Thông thường, bản thân các giai đoạn hưng cảm nhẹ không gây ra sự suy giảm. Thay vào đó, sự suy giảm là do các giai doạn trầm cảm điển hình và do một mẫu dai dẳng của sự thay đổi khí sắc không tiên đoán được và chức năng nghề nghiệp và quan hệ giữa người với người là hay thay đổi và không tin cậy. Những người bị rối loạn lưỡng cực II có thể không coi giai đoạn hưng cảm nhẹ là một điều bất lợi hay bệnh lý, cho dù hành vi thất thường của người đó có thể gây rắc rối cho người khác. Bạn bè hoặc người thân, họ hàng thường cung cấp những thông tin lâm sàng hữu ích cần thiết khi chẩn đoán rối loạn lưỡng cực II.Giai đoạn hưng cảm nhẹ không nên bị nhầm lẫn với một vài ngày vui vẻ và năng lượng phục hồi hoặc hoạt động theo sau quá trình thuyên giảm của trầm cảm điển hình. Cho dù có sự khác biệt đáng kể giữa độ nặng giữa giai đoạn hưng cảm và giai đoạn hưng cảm nhẹ, song rối loạn lưỡng cực II không phải là một dạng nhẹ của rối loạn lưỡng cực I. So với những người mắc rối loạn lưỡng cực I, những người mắc rối loạn lưỡng cực II có độ mãn tính của căn bệnh lớn hơn, và trung bình có nhiều thời gian hơn ở giai đoạn trầm cảm, và có thể nặng và gây khuyết tật. Những triệu chứng trầm cảm đồng diễn với một giai đoạn hưng cảm nhẹ hoặc các triệu chứng hưng cảm nhẹ đồng diễn với một giai đoạn trầm cảm là phổ biến ở những người bị rối loạn lưỡng cực II và thường biểu hiện nhiều ở nữ giới, đặc biệt là người bị hưng cảm nhẹ với những đặc điểm hỗn hợp.', '3.2.2 Giai đoạn trầm cảm chủ yếu\n[3.2.2 Giai đoạn trầm cảm chủ yếu > 3.2 Rối loạn lưỡng cực II > 3 RỐI LOẠN LƯỠNG CỰC VÀ CÁC RỐI LOẠN LIÊN QUAN]\n3.2.2 Giai đoạn trầm cảm chủ yếu 3.2.2 Giai đoạn trầm cảm chủ yếu  3.2 Rối loạn lưỡng cực II  3 RỐI LOẠN LƯỠNG CỰC VÀ CÁC RỐI LOẠN LIÊN QUAN. Bệnh thường bắt đầu nhất với giai đoạn trầm cảm, và không được nhận ra là rối loạn lưỡng cực II cho đến khi một giai đoạn hưng cảm nhẹ xảy ra; trường hợp này xảy ra với khoảng 12 người bệnh với chẩn đoán ban đầu là rối loạn trầm cảm điển hình. Các rối loạn lo âu, sử dụng chất, hoặc rối loạn ăn uống có thể diễn ra trước khi chẩn đoán, làm cho việc phát hiện trở nên phức tạp. Nhiều người phải trải qua vài giai đoạn trầm cảm điển hình trước khi giai đoạn hưng cảm nhẹ được phát hiện.Số giai đoạn trong đời (các giai đoạn hưng cảm nhẹ và trầm cảm điển hình) có xu hướng cao hơn ở rối loạn lưỡng cực II so với rối loạn trầm cảm điển hình hay rối loạn lưỡng cực I. Tuy nhiên, những người mắc chứng rối loạn lưỡng cực I thực tế dễ có những triệu chứng hưng cảm nhẹ hơn những người mắc chứng rối loạn lưỡng cực II. Khoảng thời gian giữa hai giai đoạn khí sắc trong diễn tiến của rối loạn lưỡng cực II có xu hướng giảm khi già đi. Trong khi giai đoạn hưng cảm nhẹ là tương lai xác định rối loạn lưỡng cực II, thì các giai đoạn trầm cảm lại kéo dài hơn, và làm mất dần chức năng theo thời gian. Mặc dù trầm cảm chiếm đa số, một khi giai đoạn hưng cảm nhẹ xảy ra thì chẩn đoán sẽ trở thành rối loạn lưỡng cực II và không bao giờ quay ngược lại rối loạn trầm cảm điển hình.', '3.5 Rối loạn lưỡng cực do một bệnh cơ thể khác\n[3.5 Rối loạn lưỡng cực do một bệnh cơ thể khác > 3 RỐI LOẠN LƯỠNG CỰC VÀ CÁC RỐI LOẠN LIÊN QUAN]\n3.5 Rối loạn lưỡng cực do một bệnh cơ thể khác 3.5 Rối loạn lưỡng cực do một bệnh cơ thể khác  3 RỐI LOẠN LƯỠNG CỰC VÀ CÁC RỐI LOẠN LIÊN QUAN. A. Có đầy đủ tiêu chí của giai đoạn hưng cảm hoặc hưng cảm nhẹ, và ít nhất ba trong số những triệu chứng sau đây biểu hiện trong phần lớn các ngày của giai đoạn hưng cảm hoặc hưng cảm nhẹ hiện tại hoặc gần đây nhất:1. Loạn cảm hoặc khí sắc trầm rõ rệt, thể hiện hoặc bởi báo cáo chủ quan (cảm thấy buồn hoặc trống rỗng) hoặc do người khác quan sát thấy (hay chảy nước mắt).2. Giảm sự quan tâm và hứng thú trong tất cả, hoặc hầu như tất cả, các hoạt động (thể hiện hoặc bằng báo cáo chủ quan hoặc do người khác).3. Chậm chạp tâm thần vận động hầu như hàng ngày (người khác có thể quan sát được, không chỉ là cảm giác chủ quan về việc trở nên chậm chạp)4. Mệt mỏi, hoặc thiếu năng lượng.5. Cảm thấy vô giá trị hoặc tội lỗi quá mức hay không phù hợp (không chỉ là tự trách hay tội lỗi vì mình bị ốm).6. Các ý nghĩ tái diễn về cái chết (không chỉ là sợ chết), ý nghĩ tái diễn về tự tử mà không có kế hoạch cụ thể, hoặc nỗ lực tự tử hoặc có kế hoạch cụ thể về việc thực hiện tự tử.', '3.2.2 Giai đoạn trầm cảm chủ yếu\n[3.2.2 Giai đoạn trầm cảm chủ yếu > 3.2 Rối loạn lưỡng cực II > 3 RỐI LOẠN LƯỠNG CỰC VÀ CÁC RỐI LOẠN LIÊN QUAN]\n3.2.2 Giai đoạn trầm cảm chủ yếu 3.2.2 Giai đoạn trầm cảm chủ yếu  3.2 Rối loạn lưỡng cực II  3 RỐI LOẠN LƯỠNG CỰC VÀ CÁC RỐI LOẠN LIÊN QUAN. C. Các triệu chứng ko phải là hậu quả sinh lý của một chất hoặc bệnh lý cơ thể Lưu ý: Tiêu chuẩn A- C cho một giai đoạn trầm cảm chủ yếu.Lưu ý: Phản ứng với mất mát lớn (mất người thân, phá sản về tài chính, thiệt hại do thảm họa thiên nhiên, bệnh cơ thể nặng hoặc khuyết tật) có thể bao gồm cảm giác mãnh liệt, nhắc đi nhắc lại về sự mất mát, mất ngủ, chán ăn, giảm cân được lưu ý trong Tiêu chuẩn A có thể giống với một giai đoạn trầm cảm. Mặc dù các triệu chứng có thể được hiểu hoặc được coi là phù hợp với với sự mất mát, sự có mặt của một giai đoạn trầm cảm chủ yếu ngoài phản ứng với sự mất mát 24 đáng kể cần được xem xét cụ thể. Quyết định đòi hỏi phải đánh giá lâm sàng dựa trên bệnh sử và chuẩn mực văn hóa của sự biểu hiện đau buồn trong hoàn cảnh mất mát.Đặc điểm chẩn đoán Đặc điểm cơ bản thiết yếu của giai đoạn hưng cảm là một giai đoạn rõ rệt mà trong đó khí sắc nâng cao, chan hòa hay khó chịu một cách bất thường và dai dẳng và năng lượng, hoạt động gia tăng một cách dai dẳng, hiện diện vào hầu hết thời gian trong ngày, gần như hàng ngày trong thời gian ít nhất 1 tuần (hoặc bất kì khoảng thời gian nào nếu nhập viện là cần thiết), đi kèm theo ít nhất ba triệu chứng bổ sung từ Tiêu chí B. Nếu khí sắc là khó chịu hơn là khí sắc nâng cao hay chan hòa thì các triệu chứng trong tiêu chí B phải hiện diện.Khí sắc trong một giai đoạn hưng cảm thường được mô tả là khoan khoái, vui tươi quá mức, phấn khởi hoặc cảm thấy như ở trên đỉnh thế giới. Trong một số trường hợp, khí sắc có tính lan truyền cao, dễ nhận thấy là quá mức và đặc thù bởi sự nhiệt tình vô hạn và bừa bãi về mặt quan hệ con người, tình dục, hoặc tương tác nghề nghiệp.']","Những triệu chứng thường xuất hiện trong giai đoạn hưng cảm nhẹ của rối loạn lưỡng cực I bao gồm:

1. Tự đánh giá bản thân cao hoặc tự cao.
2. Giảm nhu cầu ngủ (ví dụ cảm thấy thoải mái chỉ sau ngủ 3 giờ).
3. Nói nhiều hơn bình thường hoặc cảm thấy có áp lực phải nói liên tục.
4. Bùng nổ ý nghĩ hoặc biểu hiện của tư duy phi tán.
5. Thiếu tập trung hay đãng trí (sự chú ý dễ bị lôi cuốn bởi các kích thích từ môi trường bên ngoài không quan trọng hoặc không liên quan).
6. Tăng hoạt động có mục đích (như hoạt động xã hội, làm việc, học tập, hoặc tình dục) hoặc kích động tâm thần vận động.
7. Bị lôi cuốn quá mức vào các hoạt động có nguy cao gây các hậu quả đau đớn (như mua sắm quá nhiều, hoạt động tình dục bừa bãi hoặc đầu tư buôn bán bất lợi).

Theo tiêu chuẩn chẩn đoán, trong giai đoạn hưng cảm nhẹ, có ba (hoặc nhiều hơn) trong số các triệu chứng trên tồn tại dai dẳng, gây chú ý bởi sự thay đổi hành vi bình thường và biểu hiện rõ ràng (Tiêu chuẩn B, 3.1.2 Giai đoạn hưng cảm nhẹ).","Tự đánh giá bản thân cao hoặc tự cao, giảm nhu cầu ngủ, nói nhiều hơn bình thường hoặc cảm thấy có áp lực phải nói liên tục, bùng nổ ý nghĩ hoặc biểu hiện của tư duy phi tán, thiếu tập trung hay đãng trí, tăng hoạt động có mục đích, bị lôi cuốn quá mức vào các hoạt động có nguy cao gây các hậu quả đau đớn",1.0,1.0,0.93
Rối loạn giao tiếp xã hội biểu hiện qua những khó khăn nào?,"['1.2.5 Rối loạn giao tiếp xã hội\n[1.2.5 Rối loạn giao tiếp xã hội > 1.2 Các rối loạn giao tiếp > 1 RỐI LOẠN PHÁT TRIỂN THẦN KINH]\n1.2.5 Rối loạn giao tiếp xã hội 1.2.5 Rối loạn giao tiếp xã hội  1.2 Các rối loạn giao tiếp  1 RỐI LOẠN PHÁT TRIỂN THẦN KINH. A. Khó khăn dai dẳng trong giao tiếp xã hội dùng lời và không dùng lời biểu thị bởi tất cả những điều sau:1. Suy giảm trong sử dụng giao tiếp cho các mục đích xã hội, như chào hỏi và chia sẻ thông tin bằng cách thức phù hợp với hoàn cảnh xã hội.2. Suy giảm khả năng thay đổi giao tiếp cho phù hợp hoàn cảnh hoặc nhu cầu của người nghe, như nói trong lớp học khác trong sân chơi, nói chuyện với 1 đứa trẻ hơn với khác biệt 1 người lớn, và tránh sử dụng ngôn ngữ quá hình thức.3. Khó tuân theo những nguyên tắc giao tiếp và người nói chuyện, như quay trở lại mạch giao tiếp, nói lại bằng các từ khác khi bị hiểu sai, và biết cách sử dụng lời nói và kí hiệu không lời để điều chỉnh tương tác.4. Khó khăn trong việc hiểu những điều không nói thẳng (phải suy luận) và không theo nghĩa đen hoặc nước đôi ( thành ngữ, câu đùa, phép ẩn dụ, đa nghĩa mà hiểu phụ thuộc vào tình huống).', '1.2.5 Rối loạn giao tiếp xã hội\n[1.2.5 Rối loạn giao tiếp xã hội > 1.2 Các rối loạn giao tiếp > 1 RỐI LOẠN PHÁT TRIỂN THẦN KINH]\n1.2.5 Rối loạn giao tiếp xã hội 1.2.5 Rối loạn giao tiếp xã hội  1.2 Các rối loạn giao tiếp  1 RỐI LOẠN PHÁT TRIỂN THẦN KINH. B. Sự suy giảm dẫn đến hạn chế hiệu quả giao tiếp, tham gia xã hội, quan hệ xã hội, thành tích học tập hoặc hoạt động nghề nghiệp, riêng lẻ hoặc kết hợp.', '1.2.5 Rối loạn giao tiếp xã hội\n[1.2.5 Rối loạn giao tiếp xã hội > 1.2 Các rối loạn giao tiếp > 1 RỐI LOẠN PHÁT TRIỂN THẦN KINH]\n1.2.5 Rối loạn giao tiếp xã hội 1.2.5 Rối loạn giao tiếp xã hội  1.2 Các rối loạn giao tiếp  1 RỐI LOẠN PHÁT TRIỂN THẦN KINH. D. Các triệu chứng không do một bệnh cơ thể hoặc bệnh thần kinh hoặc khả năng cấu trúc từ và ngữ pháp hạn chế, và không được giải thích tốt hơn bởi rối loạn phổ tự kỉ, rối loạn phát triển trí tuệ, chậm phát triển tổng thể, hoặc một rối loạn tâm thần khác.4 Chẩn đoán phân biệt:- Rối loạn phổ tự kỉ.- Rối loạn tăng động/giảm chú ý.- Rối loạn lo âu xã hội (ám ảnh sợ xã hội).- Chậm phát triển trí tuệ và chậm phát triển tổng thể.', '1.2.5 Rối loạn giao tiếp xã hội\n[1.2.5 Rối loạn giao tiếp xã hội > 1.2 Các rối loạn giao tiếp > 1 RỐI LOẠN PHÁT TRIỂN THẦN KINH]\n1.2.5 Rối loạn giao tiếp xã hội 1.2.5 Rối loạn giao tiếp xã hội  1.2 Các rối loạn giao tiếp  1 RỐI LOẠN PHÁT TRIỂN THẦN KINH. C. Khởi phát của những triệu chứng trong thời kì phát triển sớm (cũng có thể không đầy đủ rõ ràng đến khi đòi hỏi của giao tiếp xã hội vượt quá khả năng hạn chế của trẻ).', '5.4 Rối loạn lo âu xã hội (ám ảnh sợ xã\n[5.4 Rối loạn lo âu xã hội (ám ảnh sợ xã > 5 RỐI LOẠN LO ÂU]\n5.4 Rối loạn lo âu xã hội (ám ảnh sợ xã 5.4 Rối loạn lo âu xã hội (ám ảnh sợ xã  5 RỐI LOẠN LO ÂU. A. Sợ hãi hay lo âurõ ràng về một hoặc Ví dụ nhiều tình huống xã hội mà trong đó bệnh nhânđược tiếp xúc và giám sát bởi người khác , dạng như tương tác xã hội (một cuộc trò chuyện, gặp gỡ những người không quen), bị quan sát (ví dụ:ăn hay uống), và trình diễn trước những người khác (ví dụ : phát biểu trước đám đông).Lưu ý: ở trẻ em, sự lo lắng phải xảy ra trong các tình huống cùng lứa tuổi và 45 không chỉ trong tương tác với người lớn.46', '15.3.1 Rối loạn nhân cách chống đối xã hội (AntisocialPersonality Disorder)\n[15.3.1 Rối loạn nhân cách chống đối xã hội (AntisocialPersonality Disorder) > 15.3 Rối loạn nhân cách nhóm B > 15 RỐI LOẠN NHÂN CÁCH]\n15.3.1 Rối loạn nhân cách chống đối xã hội (AntisocialPersonality Disorder) 15.3.1 Rối loạn nhân cách chống đối xã hội (AntisocialPersonality Disorder)  15.3 Rối loạn nhân cách nhóm B  15 RỐI LOẠN NHÂN CÁCH. A. Xem thường lẽ phải và vi phạm các qui định một cách bền vững, xuất hiện từ tuổi 15, có (3 hoặc hơn) các biểu hiện sau:1. Thất bại trong việc hòa nhập hoạt động xã hội bình thường với nhiều hành vi phạm pháp dẫn đến bị bắt giữ.2. Lừa đảo, nói dối thường xuyên, sử dụng các tên giả hoặc bẫy người khác với mục đích trục lợi hoặc giải trí.3. Bốc đồng hoặc thất bại trong thực hiện các kế hoạch đề ra trước đó.4. Dễ nổi cáu và kích động dẫn đến đánh nhau hoặc hành hạ người khác.5. Không quan tâm lo lắng đến sự an toàn của bản thân và của người khác.6. Vô trách nhiệm thể hiện trong công việc và không tuân thủ nghĩa vụ tài chính.7. Không ân hận thể hiện bằng sự vô cảm trước các sự đau đớn, ngược đãi hoặc bị mất trộm của người khác.', '5.4 Rối loạn lo âu xã hội (ám ảnh sợ xã\n[5.4 Rối loạn lo âu xã hội (ám ảnh sợ xã > 5 RỐI LOẠN LO ÂU]\n5.4 Rối loạn lo âu xã hội (ám ảnh sợ xã 5.4 Rối loạn lo âu xã hội (ám ảnh sợ xã  5 RỐI LOẠN LO ÂU. H. Sợ hãi, lo âu, hoặc né tránh là không phải do tác dụng sinh lý của một chất (ví dụ, nghiện ma túy, một thuốc) hoặc một bệnh khác.Chẩn đoán phân biệt:- Sự xấu hổ thông thường.- Ám ảnh sợ khoảng trống.- Rối loạn hoảng sợ.- Rối loạn lo âu lan tỏa.- Rối loạn lo âu chia tách.- Ám ảnh sợ biệt định.- Câm chọn lọc.- Rối loạn trầm cảm chủ yếu.- Rối loạn loạn dị dạng cơ thể.- Rối loạn hoang tưởng.- Rối loạn phổ tự kỉ.- Các rối loạn nhân cách.- Các rối loạn tâm thần khác.- Các bệnh cơ thể khác.- Rối loạn hành vi chống đối.', '5.4 Rối loạn lo âu xã hội (ám ảnh sợ xã\n[5.4 Rối loạn lo âu xã hội (ám ảnh sợ xã > 5 RỐI LOẠN LO ÂU]\n5.4 Rối loạn lo âu xã hội (ám ảnh sợ xã 5.4 Rối loạn lo âu xã hội (ám ảnh sợ xã  5 RỐI LOẠN LO ÂU. G. Sự sợ hãi, lo âu, hoặc né tránh gây ra đau khổ trên lâm sàng hoặc gây suy giảm chức năng xã hội, nghề nghiệp, hoặc chức năng quan trọng khác.', '1.4 Rối loạn tăng động/giảm chú ý\n[1.4 Rối loạn tăng động/giảm chú ý > 1 RỐI LOẠN PHÁT TRIỂN THẦN KINH]\n1.4 Rối loạn tăng động/giảm chú ý 1.4 Rối loạn tăng động/giảm chú ý  1 RỐI LOẠN PHÁT TRIỂN THẦN KINH. Thường chạy quanh hoặc leo trèo trong tình huống không thích hợp (Chú ý: ở trẻ vị thành niên hoặc người lớn có thể chỉ biểu hiện cảm giác bồn chồn).d. Thường không thể chơi hoặc tham gia các hoạt động giải trí một cách trật tự.e. Thường như là bận rộn, hành động như là bị gắn động cơ (ví dụ, không thể hoặc khó chịu khi duy trì thêm một khoảng thời gian ở những nơi như nhà hàng, hội nghị; có thể được người khác nhận thấy bồn chồn hoặc khó theo kịp).f. Thường nói chuyện quá nhiều.g. Thường nhanh nhảu trả lời trước khi nghe được đầy đủ câu hỏi (như để cho ai đó nói xong; không thể chờ đến lượt của mình trong cuộc nói chuyện).h. Thường không thể chờ đến lượt (như đang xếp hàng).i. Thường ngắt lời hoặc xâm phạm đến vấn đề của người khác (như xen vào cuộc nói chuyện, trò chơi hoặc hoạt động của người khác; có thể tự ý sử dụng đồ vật của người khác mà không xin phép; đối với trẻ vị thành niên và người trưởng thành, có thể vào bừa hoặc giành lấy việc người khác đang làm).', '15.4.2 Rối loạn nhân cách phụ thuộc\n[15.4.2 Rối loạn nhân cách phụ thuộc > 15.4 Rối loạn nhân cách nhóm C > 15 RỐI LOẠN NHÂN CÁCH]\n15.4.2 Rối loạn nhân cách phụ thuộc 15.4.2 Rối loạn nhân cách phụ thuộc  15.4 Rối loạn nhân cách nhóm C  15 RỐI LOẠN NHÂN CÁCH. 3. Khó biểu hiện sự phản đối với người khác do sợ bị mất sự hỗ trợ. Lưu ý:không bao gồm sợ bị trả thù thực sự.']","Rối loạn giao tiếp xã hội biểu hiện qua những khó khăn dai dẳng trong giao tiếp xã hội dùng lời và không dùng lời, bao gồm:

1. Suy giảm trong sử dụng giao tiếp cho các mục đích xã hội, như chào hỏi và chia sẻ thông tin bằng cách thức phù hợp với hoàn cảnh xã hội (Tiêu chí A.1).
2. Suy giảm khả năng thay đổi giao tiếp cho phù hợp hoàn cảnh hoặc nhu cầu của người nghe, như nói trong lớp học khác trong sân chơi, nói chuyện với 1 đứa trẻ hơn với khác biệt 1 người lớn, và tránh sử dụng ngôn ngữ quá hình thức (Tiêu chí A.2).
3. Khó tuân theo những nguyên tắc giao tiếp và người nói chuyện, như quay trở lại mạch giao tiếp, nói lại bằng các từ khác khi bị hiểu sai, và biết cách sử dụng lời nói và kí hiệu không lời để điều chỉnh tương tác (Tiêu chí A.3).
4. Khó khăn trong việc hiểu những điều không nói thẳng (phải suy luận) và không theo nghĩa đen hoặc nước đôi (thành ngữ, câu đùa, phép ẩn dụ, đa nghĩa mà hiểu phụ thuộc vào tình huống) (Tiêu chí A.4).

Những khó khăn này dẫn đến hạn chế hiệu quả giao tiếp, tham gia xã hội, quan hệ xã hội, thành tích học tập hoặc hoạt động nghề nghiệp, riêng lẻ hoặc kết hợp (Tiêu chí B).","Suy giảm trong sử dụng giao tiếp cho các mục đích xã hội, suy giảm khả năng thay đổi giao tiếp cho phù hợp hoàn cảnh hoặc nhu cầu của người nghe, khó tuân theo những nguyên tắc giao tiếp và người nói chuyện, khó khăn trong việc hiểu những điều không nói thẳng",1.0,1.0,0.76
Rối loạn thần kinh - nhận thức nhẹ hoặc chủ yếu do đâu?,"['14.2.14 Rối loạn thần kinh - nhận thức nhẹ hoặc chủ yếu do nhiều\n[14.2.14 Rối loạn thần kinh - nhận thức nhẹ hoặc chủ yếu do nhiều > 14.2 Các rối loạn thần kinh - nhận thức chủ yếu và nhẹ (Major and Mild > 14 RỐI LOẠN THẦN KINH NHẬN THỨC]\n14.2.14 Rối loạn thần kinh - nhận thức nhẹ hoặc chủ yếu do nhiều 14.2.14 Rối loạn thần kinh - nhận thức nhẹ hoặc chủ yếu do nhiều  14.2 Các rối loạn thần kinh - nhận thức chủ yếu và nhẹ (Major and Mild  14 RỐI LOẠN THẦN KINH NHẬN THỨC. nguyên nhân (Major or Mild Neurocongnitive Disorder Due to Multiple Etiologies) A. Rối loạn đáp ứng các tiêu chuẩn rối loạn thần kinh  nhận thức nhẹ hoặc chủ yếu. B. Trong bệnh sử, kết quả khám và xét nghiệm cận lâm sàng có bằng chứng cho thấy suy giảm thần kinh  nhậnthức là hậu quả sinh lí bệnh của một số quá trình bệnh căn, ngoại trừ các chất (ví dụ, rối loạn thần kinh - nhận thức do bệnh Alzheimer dẫn đến hậu quả rối loạn thần kinh - nhận thức mạch máu não). Chú ý: nên ưu tiên cho tiêu chuẩn chẩn đoán rối loạn thần kinh - nhận thức đa nguyên nhân do những bệnh cơ thể biệt định trên cơ sở xác định được các bệnh căn cụ thể. C. Rối loạn thần kinh - nhận thức không thể được giải thích tốt hơn bởi một rối loạn tâm thần khác và không xuất hiện trong trạng thái sảng.', '14.2.6 Rối loạn thần kinh - nhận thức nhẹ hoặc chủ yếu do mạch máu não\n[14.2.6 Rối loạn thần kinh - nhận thức nhẹ hoặc chủ yếu do mạch máu não > 14.2 Các rối loạn thần kinh - nhận thức chủ yếu và nhẹ (Major and Mild > 14 RỐI LOẠN THẦN KINH NHẬN THỨC]\n14.2.6 Rối loạn thần kinh - nhận thức nhẹ hoặc chủ yếu do mạch máu não 14.2.6 Rối loạn thần kinh - nhận thức nhẹ hoặc chủ yếu do mạch máu não  14.2 Các rối loạn thần kinh - nhận thức chủ yếu và nhẹ (Major and Mild  14 RỐI LOẠN THẦN KINH NHẬN THỨC. (Major or Mild Vascular Neurocongnitive Disorder)', '14.2.3 Rối loạn thần kinh-nhận thức chủ yếu hoặc nhẹ do bệnh Alzheimer\n[14.2.3 Rối loạn thần kinh-nhận thức chủ yếu hoặc nhẹ do bệnh Alzheimer > 14.2 Các rối loạn thần kinh - nhận thức chủ yếu và nhẹ (Major and Mild > 14 RỐI LOẠN THẦN KINH NHẬN THỨC]\n14.2.3 Rối loạn thần kinh-nhận thức chủ yếu hoặc nhẹ do bệnh Alzheimer 14.2.3 Rối loạn thần kinh-nhận thức chủ yếu hoặc nhẹ do bệnh Alzheimer  14.2 Các rối loạn thần kinh - nhận thức chủ yếu và nhẹ (Major and Mild  14 RỐI LOẠN THẦN KINH NHẬN THỨC. B. Có khởi phát âm thầm và tiến triển từ từ của sự suy giảm trong 1 hoặc nhiều lĩnh vực nhận thức (với rối loạn thần kinh -nhận thức chủ yếu, ít nhất hai lĩnh vực phải suy giảm).', '14.2.6 Rối loạn thần kinh - nhận thức nhẹ hoặc chủ yếu do mạch máu não\n[14.2.6 Rối loạn thần kinh - nhận thức nhẹ hoặc chủ yếu do mạch máu não > 14.2 Các rối loạn thần kinh - nhận thức chủ yếu và nhẹ (Major and Mild > 14 RỐI LOẠN THẦN KINH NHẬN THỨC]\n14.2.6 Rối loạn thần kinh - nhận thức nhẹ hoặc chủ yếu do mạch máu não 14.2.6 Rối loạn thần kinh - nhận thức nhẹ hoặc chủ yếu do mạch máu não  14.2 Các rối loạn thần kinh - nhận thức chủ yếu và nhẹ (Major and Mild  14 RỐI LOẠN THẦN KINH NHẬN THỨC. C. Trong bệnh sử, kết quả khám và /hoặc hình ảnh thần kinh có bằng chứng về bệnh mạch máu não được xem là phù hợp với suy giảm thần kinh  nhậnthức.', '14.2.3 Rối loạn thần kinh-nhận thức chủ yếu hoặc nhẹ do bệnh Alzheimer\n[14.2.3 Rối loạn thần kinh-nhận thức chủ yếu hoặc nhẹ do bệnh Alzheimer > 14.2 Các rối loạn thần kinh - nhận thức chủ yếu và nhẹ (Major and Mild > 14 RỐI LOẠN THẦN KINH NHẬN THỨC]\n14.2.3 Rối loạn thần kinh-nhận thức chủ yếu hoặc nhẹ do bệnh Alzheimer 14.2.3 Rối loạn thần kinh-nhận thức chủ yếu hoặc nhẹ do bệnh Alzheimer  14.2 Các rối loạn thần kinh - nhận thức chủ yếu và nhẹ (Major and Mild  14 RỐI LOẠN THẦN KINH NHẬN THỨC. D. Rối loạn không được giải thích tốt hơ bởi bệnh mạch máu não, bệnh thoái hóa thần kinh khác, tác động của một chất, hoặc bệnh tâm thần, thần kinh hoặc hệ thống khác.', '14.2.6 Rối loạn thần kinh - nhận thức nhẹ hoặc chủ yếu do mạch máu não\n[14.2.6 Rối loạn thần kinh - nhận thức nhẹ hoặc chủ yếu do mạch máu não > 14.2 Các rối loạn thần kinh - nhận thức chủ yếu và nhẹ (Major and Mild > 14 RỐI LOẠN THẦN KINH NHẬN THỨC]\n14.2.6 Rối loạn thần kinh - nhận thức nhẹ hoặc chủ yếu do mạch máu não 14.2.6 Rối loạn thần kinh - nhận thức nhẹ hoặc chủ yếu do mạch máu não  14.2 Các rối loạn thần kinh - nhận thức chủ yếu và nhẹ (Major and Mild  14 RỐI LOẠN THẦN KINH NHẬN THỨC. A. Rối loạn đáp ứng các tiêu chuẩn rối loạn thần kinh  nhận thức nhẹ hoặc chủ yếu.', '14.2.13 Rối loạn thần kinh - nhận thức nhẹ hoặc chủ yếu do một bệnh cơ\n[14.2.13 Rối loạn thần kinh - nhận thức nhẹ hoặc chủ yếu do một bệnh cơ > 14.2 Các rối loạn thần kinh - nhận thức chủ yếu và nhẹ (Major and Mild > 14 RỐI LOẠN THẦN KINH NHẬN THỨC]\n14.2.13 Rối loạn thần kinh - nhận thức nhẹ hoặc chủ yếu do một bệnh cơ 14.2.13 Rối loạn thần kinh - nhận thức nhẹ hoặc chủ yếu do một bệnh cơ  14.2 Các rối loạn thần kinh - nhận thức chủ yếu và nhẹ (Major and Mild  14 RỐI LOẠN THẦN KINH NHẬN THỨC. thể khác (Major or Mild Neurocognitive Disorder Due to Another Medical Condition) A. Rối loạn đáp ứng các tiêu chuẩn rối loạn thần kinh  nhận thức nhẹ hoặc chủ yếu. B. Trong bệnh sử, kết quả khám và xét nghiệm cận lâm sàng có bằng chứng cho thấy suy giảm thần kinh  nhậnthức là hậu quả sinh lí bệnh của một bệnh cơ thể khác. C. Rối loạn thần kinh - nhận thức không thể được giải thích tốt hơn bởi một rối loạn tâm thần khác hoặc một rối loạn thần kinh - nhận thức biệt định khác (ví dụ, bệnh Alzheimer, nhiễm HIV).', '14.2.6 Rối loạn thần kinh - nhận thức nhẹ hoặc chủ yếu do mạch máu não\n[14.2.6 Rối loạn thần kinh - nhận thức nhẹ hoặc chủ yếu do mạch máu não > 14.2 Các rối loạn thần kinh - nhận thức chủ yếu và nhẹ (Major and Mild > 14 RỐI LOẠN THẦN KINH NHẬN THỨC]\n14.2.6 Rối loạn thần kinh - nhận thức nhẹ hoặc chủ yếu do mạch máu não 14.2.6 Rối loạn thần kinh - nhận thức nhẹ hoặc chủ yếu do mạch máu não  14.2 Các rối loạn thần kinh - nhận thức chủ yếu và nhẹ (Major and Mild  14 RỐI LOẠN THẦN KINH NHẬN THỨC. B. Các đặc điểm lâm sàng luôn đồng hành cùng bệnh căn mạch máu não, thể hiện qua 1 trong 2 điểm dưới đây:1. Khởi phát suy giảm nhận thức luôn gắn với một/hoặc nhiều hơn sự cố tai biến mạch máu não.2. Có bằng chứng cho thấy sự suy giảm thể hiện rõ nét trong chú ý phức tạp (bao gồm cả vận tốc xử lí) và chức năng điều hành  vùng trán.', '14.2.4 Rối loạn thần kinh - nhận thức trán thái dương mức độ nhẹ hoặc chủ\n[14.2.4 Rối loạn thần kinh - nhận thức trán thái dương mức độ nhẹ hoặc chủ > 14.2 Các rối loạn thần kinh - nhận thức chủ yếu và nhẹ (Major and Mild > 14 RỐI LOẠN THẦN KINH NHẬN THỨC]\n14.2.4 Rối loạn thần kinh - nhận thức trán thái dương mức độ nhẹ hoặc chủ 14.2.4 Rối loạn thần kinh - nhận thức trán thái dương mức độ nhẹ hoặc chủ  14.2 Các rối loạn thần kinh - nhận thức chủ yếu và nhẹ (Major and Mild  14 RỐI LOẠN THẦN KINH NHẬN THỨC. B. Rối loạn có khởi phát âm thầm và tiến triển từ từ.', '14.2.4 Rối loạn thần kinh - nhận thức trán thái dương mức độ nhẹ hoặc chủ\n[14.2.4 Rối loạn thần kinh - nhận thức trán thái dương mức độ nhẹ hoặc chủ > 14.2 Các rối loạn thần kinh - nhận thức chủ yếu và nhẹ (Major and Mild > 14 RỐI LOẠN THẦN KINH NHẬN THỨC]\n14.2.4 Rối loạn thần kinh - nhận thức trán thái dương mức độ nhẹ hoặc chủ 14.2.4 Rối loạn thần kinh - nhận thức trán thái dương mức độ nhẹ hoặc chủ  14.2 Các rối loạn thần kinh - nhận thức chủ yếu và nhẹ (Major and Mild  14 RỐI LOẠN THẦN KINH NHẬN THỨC. yếu (Major or Mild Frontotemporal Neurocongnitive Disorder)']","Rối loạn thần kinh - nhận thức nhẹ hoặc chủ yếu có thể do nhiều nguyên nhân khác nhau. Theo tiêu chuẩn chẩn đoán trong DSM-5, các nguyên nhân có thể bao gồm:

- Bệnh Alzheimer (14.2.3): Rối loạn thần kinh-nhận thức chủ yếu hoặc nhẹ do bệnh Alzheimer, với khởi phát âm thầm và tiến triển từ từ của sự suy giảm trong 1 hoặc nhiều lĩnh vực nhận thức.
- Bệnh mạch máu não (14.2.6): Rối loạn thần kinh - nhận thức nhẹ hoặc chủ yếu do mạch máu não, với bằng chứng về bệnh mạch máu não được xem là phù hợp với suy giảm thần kinh nhận thức.
- Một bệnh cơ thể khác (14.2.13): Rối loạn thần kinh - nhận thức nhẹ hoặc chủ yếu do một bệnh cơ thể khác, với bằng chứng cho thấy suy giảm thần kinh nhận thức là hậu quả sinh lí bệnh của một bệnh cơ thể khác.
- Nhiều nguyên nhân (14.2.14): Rối loạn thần kinh - nhận thức nhẹ hoặc chủ yếu do nhiều nguyên nhân, với bằng chứng cho thấy suy giảm thần kinh nhận thức là hậu quả sinh lí bệnh của một số quá trình bệnh căn.

Tùy thuộc vào từng trường hợp cụ thể, cần phải xem xét các tiêu chuẩn chẩn đoán và bằng chứng lâm sàng để xác định nguyên nhân chính xác của rối loạn thần kinh - nhận thức nhẹ hoặc chủ yếu.",mạch máu não,1.0,0.6666666666666666,0.0
